id,sentence,difficulty;;;;;;;;;;;;
"1233,""De fait, la nature peut √™tre, par l'homme, chang√©e tout √† fait, transform√©e, √©branl√©e jusqu'en ses fondements, et c'est pourquoi il sied de r√©habiliter le mot de magie, en lui redonnant le sens honorable qu'il avait autrefois et en d√©signant par l√† une science justement ambitieuse qui, de la connaissance des formes cach√©es, d√©duit des op√©rations √©tonnantes."",C2";;;;;;;;;;;;
1234,Le bleu est tr√®s pr√©sent dans la nature : c'est la couleur du ciel et de la mer.,A1;;;;;;;;;;;;
"1235,""Elle fais ses devoirs puis pr√©pare le d√Æner et finalement, elle regarde un film avant d'aller se coucher."",A2";;;;;;;;;;;;
1236,Pas de f√™te avec vous ce soir,A1;;;;;;;;;;;;
1237,Je n'arrive plus √† dormir depuis quelques jours √† cause de mes voisins et leurs travaux.,A2;;;;;;;;;;;;
"1238,""C'√©tait une ch√©tive cr√©ature, une masse de chair rid√©e, avec des paupi√®res entre-closes, des traits informes et √† peine √©bauch√©s."",C2";;;;;;;;;;;;
1239,J'aime les pommes de terre.,A1;;;;;;;;;;;;
1240,Elle a juste miaul√© craintivement et s'est recroquevill√©e sur sa branche o√∫ elle se trouve.,B2;;;;;;;;;;;;
"1241,""Mesdames, messieurs, votre attention s'il vous pla√Æt."",A2";;;;;;;;;;;;
"1242,""En cinquante ans, les progr√®s accomplis par les techniques de l'information ont entra√Æn√© une amplification extraordinaire des flux d'informations."",C1";;;;;;;;;;;;
1243,Je regarde un film en allemand.,A1;;;;;;;;;;;;
1244,Les vacances sont les moments pr√©f√©r√©s de Pierre car il a pour habitude d'aller chez ses grands-parents qui vivent dans une ferme de la campagne normande,A1;;;;;;;;;;;;
1245,Figurez-vous un Turc allant la nuit chez Paul Niquet!,B2;;;;;;;;;;;;
1246,La comtesse s'√©tait passionn√©e pour le caract√®re primitif et pour l'astrologie de l'abb√© Blan√®s.,C1;;;;;;;;;;;;
"1247,""Pour dissuader ses lyceÃÅens de faire les Beaux-arts, l'EÃÅcole du cirque ou un diploÃÇme d'arts du spectacle, un proviseur avait coutume de leur raconter cette histoire : """"J'avais deux copains"",C1";;;;;;;;;;;;
"1248,""Perrette, retenant sa respiration tellement √©tait forte l'odeur naus√©abonde d'huile de vidange, dans la chambre-garage."",C1";;;;;;;;;;;;
"1249,""N√©anmoins, l'introduction de la notion de genre dans la sant√© entra√Æne une meilleure compr√©hension des processus biologiques et sociaux intriqu√©s qui influencent les trajectoires de sant√© des hommes et des femmes."",C1";;;;;;;;;;;;
"1250,""Pour conjurer les deux mois de vacances, ils acheÃÄtent donc leur potion en librairie pour un investissement moyen de 7 euros"",C2";;;;;;;;;;;;
1251,Le courant d'air ainsi cr√©√© permet √† la sueur - qui absorbe la chaleur du corps - de s'√©vaporer et ainsi de le refroidir.,B1;;;;;;;;;;;;
"1252,""La pelle, les pincettes et le bec du soufflet, tous de proportion colossale, brillaient comme de l'acier poli, tandis que le long des murs s'√©tendait une abondante batterie de cuisine, o√π miroitait in√©galement la flamme claire du foyer, jointe aux premi√®res lueurs du soleil arrivant par les carreaux."",C2";;;;;;;;;;;;
1253,Mais les chiens et les chats ne s'aiment pas beaucoup .,A1;;;;;;;;;;;;
"1254,""Il s'offre les meilleurs guides, gravit les montagnes, s'eÃÅpanouit"",C1";;;;;;;;;;;;
1255,Les pr√©adolescents et adolescents semblent particuli√®rement sensibles.,B2;;;;;;;;;;;;
"1256,""Les cordes vocales, ce sont des muscles, hein, et donc, j'ai un entra√Ænement quotidien parce qu'on doit √™tre raccord avec des enregistrements qui ont quelquefois 10 voire 15 ans"",B2";;;;;;;;;;;;
"1257,""Elle trouvait √ßa dr√¥le, finissait par rire, et, s'animant, commen√ßait √† trottiner derri√®re lui, avec de l√©gers cris joyeux et craintifs, quand elle 143 avait cru le saisir."",C2";;;;;;;;;;;;
1258,Il est en train de ranger ses affaires.,A2;;;;;;;;;;;;
"1259,""Tout comme la r√©volution industrielle a vu na√Ætre le capitalisme, je suis persuad√© que la robolution va profond√©ment modifier notre syst√®me √©conomique."",B2";;;;;;;;;;;;
"1260,""On a ainsi constat√©, chez les femmes urbaines de haut niveau socio-√©conomique, au Br√©sil, 28 % de r√©duction de la surcharge pond√©rale de 1989 √† 1997."",C1";;;;;;;;;;;;
1261,Cette r√©ponse me bouleversa.,C2;;;;;;;;;;;;
"1262,""[Les dames rient] Je pense qu'il y aurait de la bagarre, hein"",A2";;;;;;;;;;;;
"1263,""Tu ne m√©rites pas d'en manger, dit l'autre."",A2";;;;;;;;;;;;
"1264,""Jeune retrait√© de l'√©ducation nationale, Roger Rougier a sa r√©ponse."",C1";;;;;;;;;;;;
1265,Tout se passe bien en France ?,B1;;;;;;;;;;;;
"1266,""Non, elle est fleuriste."",A1";;;;;;;;;;;;
"1267,""Sans enfants √† cinquante-neuf ans, Guido avait, de son propre coeur, pr√©par√© pour son enfant √† venir un coeur model√© sur sa propre pr√©occupation : l'hommage sans remords √† la noblesse, la g√©nuflexion que fait par contraction musculaire le corps pourchass√© en s'affalant devant ce qui est imminent et inaccessible comme devant une grande chaleur."",C2";;;;;;;;;;;;
1268,Le plat plein ploie sous le poids ou ne ploie point ?,C2;;;;;;;;;;;;
"1269,""Et vous l'entendez, ce violon qui joue du klezmer, la musique traditionnelle des juifs itin√©rants ?"",B2";;;;;;;;;;;;
"1270,""Un principe qui concerne d√©j√† de nombreux produits tels que les emballages, les textiles et les pneus."",B2";;;;;;;;;;;;
"1271,""Non, bien s√ªr que non."",A2";;;;;;;;;;;;
1272,J'ai une soeur,A1;;;;;;;;;;;;
1273,Et j'adresse un d√©fi collectif au parterre !,B2;;;;;;;;;;;;
"1274,""En √©tant connect√© en permanence √† ses amis et en pouvant """"se raccrocher"""" √† des environnements en ligne familiers, comme sa page Facebook, son compte Twitter ou sa story Snapchat, la personne, √©loign√©e de son environnement familier, ne se sentirait-elle pas alors davantage en s√©curit√© affective, comme dans son foyer o√π elle a ses rep√®res et habitudes rassurants ?"",C2";;;;;;;;;;;;
1275,La blanquette est bonne.,A2;;;;;;;;;;;;
1276,L'Empereur √©tait √† Paris.,B1;;;;;;;;;;;;
"1277,""Je m'appelle Laurent et j'habite √† Paris avec mes parents, ma soeur ain√©e et mon fr√®re."",A2";;;;;;;;;;;;
"1278,""Puis, il y eut une pause lugubre, suivie d'un vaste soupir d'agonie o√π l'on e√ªt dit que l'√¢me de la grosse cloche s'exhalait."",C2";;;;;;;;;;;;
1279,La r√®gle du frein √† l'endettement devrait traiter de mani√®re sym√©trique les d√©passements de d√©penses et les √©conomies r√©alis√©es.,C1;;;;;;;;;;;;
"1280,""La spirale vicieuse, cette m√©canique qui entra√Æne vers le bas, n'est pas, dans le discours des milieux populaires, li√©e √† une conjoncture n√©gative."",B2";;;;;;;;;;;;
1281,Ils ne se parlent plus depuis qu'ils se sont disput√©s.,B1;;;;;;;;;;;;
"1282,""Pour Yak Rivais, le langage fait certes travailler le cerveau, mais aussi l'oeil et l'oreille."",B2";;;;;;;;;;;;
"1283,""En brisant le fatum des itin√©raires sociaux, en augmentant le temps de la formation, en accroissant l'autonomie des individus, les soci√©t√©s modernes ont invent√© la jeunesse et celle-ci ne cesse de s'allonger, jusqu'√† 25 ans et au-del√†."",B2";;;;;;;;;;;;
"1284,""Je ne me couche pas trop tard, vers minuit"",A1";;;;;;;;;;;;
"1285,""""""Nous allons essayer √† nouveau (ndlr: d'entrer en contact avec lui). Mais les chances de r√©tablir la liaison sont tr√®s tr√®s faibles"""", a d√©clar√© √† l'AFP Stephan Ulamec, responsable de l'atterrisseur, depuis l'Agence spatiale europ√©enne (ESA) √† Darmstadt (Allemagne)."",B2";;;;;;;;;;;;
"1286,""Ajoutons, pour parfaire ce tableau, que ces seniors ont re√ßu de la science la perspective d'un quart de si√®cle de long√©vit√© suppl√©mentaire travers√© en relative bonne sant√©."",B2";;;;;;;;;;;;
"1287,""Une fois ces d√©clencheurs identifi√©s, il faut alors √©laborer des strat√©gies pour les √©viter ou y faire face."",C2";;;;;;;;;;;;
1288,Elles se r√©veill√®rent tr√®s t√¥t hier matin afin de se rendre au tribunal pour plaider la cause de leurs maris injustement accus√©s d'escroquerie.,C1;;;;;;;;;;;;
"1289,""Apr√®s la transfusion, le sang provenant d'un don de sang complet ou d'un don par aph√©r√®se est congel√© √† une temp√©rature de moins 30 degr√©s Celsius et est mis en quarantaine."",C2";;;;;;;;;;;;
"1290,""Or peut-on se contenter de cette exp√©rience imm√©diate ou pour reprendre la formulation de Bergson, de cette """"donn√©e imm√©diate de la conscience"""""",C2";;;;;;;;;;;;
1291,La compagnie qui le g√®re est √† majorit√© anglaise.,B1;;;;;;;;;;;;
1292,Je profite aussi du petit-d√©jeuner pour lire les infos en ligne,A1;;;;;;;;;;;;
"1293,""Toutefois, ce syst√®me r√©pond √† des crit√®res pr√©cis et exigeants, difficilement compatibles avec le d√©veloppement √† grande √©chelle auquel il est appel√©."",C1";;;;;;;;;;;;
"1294,""Oui, la raison a pu s'accommoder de la th√©ologie pa√Øenne."",C1";;;;;;;;;;;;
"1295,""Confront√© avec rien de pire qu'un g√©n√©ral en cuir crissant et ces mouvements l√©g√®rement percutants qui sont communs aux personnages militaires, lesquels semblent aspirer l'air au- dedans, sentent la poudre √† canon et la chair de cheval, et, bien que l√©thargiques, ont l'air pr√™ts √† participer √† une guerre encore ind√©termin√©e (type d'hommes pour lequel Hedwige s'√©tait senti beaucoup d'inclination), Guido avait √©t√© secou√© d'un tremblement invisible."",C2";;;;;;;;;;;;
"1296,""Cette action avait pour objectif d√®s l'origine d'aider les professeurs √† enseigner la science et la technologie en mettant en oeuvre une p√©dagogie privil√©giant l'exp√©rimentation, la discussion, une pratique active et collective."",C2";;;;;;;;;;;;
"1297,""Elle portait une robe marron fonc√©, qui moulait sa taille, ses hanches, sa gorge, ses bras d'une fa√ßon provocante et coquette ";" et Duroy √©prouvait un √©tonnement confus, presque une g√™ne dont il ne saisissait pas bien la cause, du d√©saccord de cette √©l√©gance soign√©e et raffin√©e avec l'insouci visible pour le logis qu'elle habitait."",C2";;;;;;;;;;;
"1298,""Les papy-boomers sont individualistes, ce sont d'ailleurs eux qui ont mis en vogue le concept."",B2";;;;;;;;;;;;
1299,Une politique de s√©curit√© est un outil de gouvernance qui permet de traiter la s√©curit√© comme un processus de gestion continu en fonction d'objectifs strat√©giques clairement d√©finis.,C1;;;;;;;;;;;;
1300,Tout le monde n'a pas l'argent pour se payer une machine √† laver.,B1;;;;;;;;;;;;
"1301,""Lettres de motivation, d'amour ou de rupture, relecture de m√©moires d'√©tudiant, textes d'hommage √† lire et √† distribuer pendant des obs√®ques, situations administratives √† d√©m√™ler avec la banque, les imp√¥ts ou la copropri√©t√©, l'√©crivain public doit pouvoir r√©pondre √† toutes les demandes."",C1";;;;;;;;;;;;
1302,Et donc je te remercie pour tout ton boulot.,A2;;;;;;;;;;;;
1303,Elle se rendit compte qu'elle travaillait dans la p√©nombre et alluma la lampe pos√©e sur le bureau.,B2;;;;;;;;;;;;
"1304,""Au premier √©tage, il y a trois chambres"",B1";;;;;;;;;;;;
1305,Paul a le num√©ro de t√©l√©phone de Marie.,A1;;;;;;;;;;;;
1306,Ils font √† manger et ils nettoient toujours la cuisine juste apr√®s.,A2;;;;;;;;;;;;
1307,Elles font des cracracracracraaa ! Et moi j'en fais autant : on s'amuse !,A2;;;;;;;;;;;;
"1308,""En 2001, Rosalie a expliqu√© √† l'ONU, aupr√®s du groupe de travail sur les peuples autochtones, en quoi la survie des bisons sauvages est essentielle et symbolique pour les Indiens des plaines."",C1";;;;;;;;;;;;
"1309,""Si t'as trouv√© le vid√©o le fun, pense √† aimer notre chaine YouTube et notre page Facebook"",C1";;;;;;;;;;;;
"1310,""Par crainte des repr√©sailles, les contestataires ont √©t√© moins nombreux mardi dans les rues."",B2";;;;;;;;;;;;
"1311,""Ce r√©cit fascine toujours notre science-fiction, Blade Runner de Ridley Scott (1982) ou Her de Spike Jonze (2013) en t√©moignent."",B2";;;;;;;;;;;;
"1312,""Mon √©nergie, mon temps, mon argent."",A2";;;;;;;;;;;;
1313,Qu'est-ce que tu penses de cette peinture ?,A1;;;;;;;;;;;;
"1314,""En France, c'est l'enseignement catholique qui, le premier, a os√© briser le tabou, en rediscutant des vices et vertus de la mixit√© depuis ses assises de d√©cembre 2000."",C1";;;;;;;;;;;;
"1315,""Si nous sommes bloqu√©s dans l'ascenseur qui s'est arr√™t√© brusquement, nous appellerons du secours d√®s que la communication sera √©tablie."",B2";;;;;;;;;;;;
"1316,""Il vient de la racine slave """"robota"""" qui signifie travail de force."",C2";;;;;;;;;;;;
1317,Il a donc rejet√© tout changement de mode de scrutin qui introduirait des m√©canismes partisans et abstraits dans ces collectivit√©s o√π l'appartenance politique des √©lus est fort peu prise en compte.,C1;;;;;;;;;;;;
1318,Mais les chocs p√©troliers plongent la France dans la crise,C1;;;;;;;;;;;;
1319,Ce texte invite les √âtats √† prendre toutes les mesures possibles dans la pratique pour veiller √† ce que les membres de leurs forces arm√©es qui n'ont pas atteint l'√¢ge de 18 ans ne participent pas directement aux hostilit√©s (Art.,B1;;;;;;;;;;;;
"1320,""Vous √™tes biologiste, militante passionn√©e de cette p√©dagogie, vous allez nous expliquer pourquoi le sujet vous passionne."",C1";;;;;;;;;;;;
1321,Souvent elle √©tait r√™veuse et taciturne ; quelquefois elle parlait avec imp√©tuosit√©.,C2;;;;;;;;;;;
1322,La dame ne vient pas.,A1;;;;;;;;;;;;
"1323,""Apr√®s cette crise, qui se renouvelle toutes les nuits, je dors enfin, avec calme, jusqu'√† l'aurore"",B2";;;;;;;;;;;;
1324,Elle raconte leur quotidien √† travers les enfants qu'elle a aussi aid√©s √† faire leurs devoirs,A2;;;;;;;;;;;;
1325,On peut voir aussi le fleuve qui traverse la capitale,B1;;;;;;;;;;;;
"1326,""Bruno Bonnell Le vieil adage """"on n'arr√™te pas le progr√®s"""" n'a jamais √©t√© aussi vivace. D'autres pays s'√©quipent en robotique pour atteindre des taux de productivit√© sup√©rieurs aux n√¥tres."",C1";;;;;;;;;;;;
"1327,""Or, la plupart du temps, la jeunesse est heureuse, ni aussi tragique ni aussi banale que ne le dessinent les clich√©s."",B2";;;;;;;;;;;;
1328,De hauts sapins noirs interdisaient √† la lumi√®re du soleil de p√©n√©trer dans le sous-bois o√π serpentait un obscur sentier bord√© de silhouettes mena√ßantes pr√™tes √† nous bondir dessus.,C2;;;;;;;;;;;;
1329,Il s'arr√™ta tristement √† la porte d'un cabaret.,B1;;;;;;;;;;;;
1330,Ouais !,A1;;;;;;;;;;;;
"1331,""Et des trous s'enfonc√®rent dans ces alluvions de l'espace, des trous infundibuliformes, roux, par lesquels filtra une lumi√®re de lanterne sourde."",C2";;;;;;;;;;;;
1332,Le travail permet en effet √† l'Homme de se lib√©rer d'aspects contraignant li√©s √† l'existence humaine,C2;;;;;;;;;;;;
"1333,""Je ne savais pas que, bien plus tristement que les petits √©carts de r√©gime de son mari, mon manque de volont√©, ma sant√© d√©licate, l'incertitude qu'ils projetaient sur mon avenir, pr√©occupaient ma grand'm√®re au cours de ces d√©ambulations incessantes de l'apr√®s-midi et du soir, o√π on voyait passer et repasser, obliquement lev√© vers le ciel, son beau visage aux joues brunes et sillonn√©es, devenues au retour de l'√¢ge presque mauves comme les labours √† l'automne, barr√©es, si elle sortait, par une voilette √† demi relev√©e, et sur lesquelles, amen√© l√† par le froid ou quelque triste pens√©e, √©tait toujours en train de s√©cher un pleur involontaire."",C2";;;;;;;;;;;;
"1334,""Les imp√¥ts sur l'√©nergie comprennent essentiellement les imp√¥ts sur les carburants, la taxe CO2 sur les combustibles et le suppl√©ment sur les co√ªts de transport d'√©lectricit√©."",C1";;;;;;;;;;;;
1335,J'y suis all√© hier en scooter.,A2;;;;;;;;;;;;
1336,Tu √©tais ma meilleure amie et tu avais toujours plein de bonnes id√©es pour s'amuser,A2;;;;;;;;;;;;
"1337,""Oui, comme entr√©e ?"",A1";;;;;;;;;;;;
1338,Il a demand√© la raison de cette d√©cision.,A2;;;;;;;;;;;;
"1339,""S'il fait beau, l'apr√®s-midi vous pouvez aller au jardin du Luxembourg."",A1";;;;;;;;;;;;
"1340,""Pourtant, dans les ann√©es 1890, les gar√ßons coiffeurs et les employ√©s des grands magasins manifestent, avec le soutien de la CGT, pour obtenir une demi-journ√©e de repos hebdomadaire."",C2";;;;;;;;;;;;
"1341,""De la m√™me fa√ßon, le gouvernement de la R√©publique du Congo (RDC) s'est engag√©, en mai 2002, √† d√©mobiliser des milliers d'enfants servant dans son arm√©e."",B1";;;;;;;;;;;;
1342,Personne n'√©tait int√©ress√© par les discours du d√©put√©,B1;;;;;;;;;;;;
1343,Enseigner √† une enfant qu'il peut r√©ussir.,A2;;;;;;;;;;;;
1344,Vous ne passerez pas !,A2;;;;;;;;;;;;
1345,Il avait emprunt√© le couloir exigu qui menait aux dortoirs des filles.,C2;;;;;;;;;;;;
"1346,""De quelles hu√©es gouailleuses, de quelles curiosit√©s grossi√®res n'√™ut-il pas √©t√© l'objet et la victime!"",B2";;;;;;;;;;;;
1347,Cette p√©riode marque l'arriv√©e de No√´l et des f√™tes de fin d'ann√©e.,A1;;;;;;;;;;;;
1348,Bien s√ªr que tu vas y aller.,A1;;;;;;;;;;;;
1349,Il a trouv√© un copain.,A1;;;;;;;;;;;;
"1350,""En France, le d√©but des vacances est soulign√© par les soldes d'√©t√©"",B1";;;;;;;;;;;;
"1351,""Elle se retrouvait dans les lectures de sa jeunesse, en plein Walter Scott."",C1";;;;;;;;;;;;
"1352,""Dans cette lettre au P√®re No√´l, ils listent m√©ticuleusement tous les cadeaux qu'ils souhaiteraient avoir au pied du sapin"",B2";;;;;;;;;;;;
"1353,""Il avait naturellement con√ßu le d√©sir de r√©p√©ter ces prouesses et, d√®s qu'il eut seize ans, il commen√ßa de s'exercer."",B2";;;;;;;;;;;;
"1354,""La deuxi√®me jambe de notre projet, ax√© sur le """"prot√©ger"""", est mise en place depuis 2017, notamment avec nos mesures en mati√®re d'√©ducation, comme le d√©doublement des classes."",C1";;;;;;;;;;;;
"1355,""J'√©tais trop √©puis√©, il m'√©tait impossible de continuer !"",B1";;;;;;;;;;;;
1356,Il eut une consolation.,C1;;;;;;;;;;;;
"1357,""Dans cette zone, les densit√©s annuelles de campagnol terrestre connues √† l'√©chelle des communes ont √©t√© attribu√©es aux taches de prairie en utilisant une pond√©ration par les surfaces relatives pour les taches chevauchant plusieurs municipalit√©s ";" au terme de cette op√©ration, chaque tache de prairie a √©t√© caract√©ris√©e par une densit√© annuelle de campagnol terrestre."",C1";;;;;;;;;;;
"1358,""Si les enfants √©crivent une lettre au P√®re No√´l, est-ce qu'il r√©pondra ?"",B1";;;;;;;;;;;;
"1359,""II y avait lu que j'√©tais un honn√™te homme, un travailleur r√©gulier, infatigable, fid√®le √† la maison qui l'employait, aim√© de tous et compatissant aux mis√®res d'autrui."",C2";;;;;;;;;;;;
"1360,""Apr√®s son enfance √† Vinci, L√©onard est √©l√®ve aupr√®s du c√©l√®bre peintre et sculpteur florentin Andrea del Verrocchio."",B2";;;;;;;;;;;;
1361,J'ai √©t√© me plaindre √† la mairie mais √ßa n'a servi √† rien !,B1;;;;;;;;;;;;
1362,La didascalie offre un √©clairage totalement nouveau de l'oeuvre.,C2;;;;;;;;;;;;
1363,Peut-on √©voquer des sujets s√©rieux avec un accent du Sud de la France ?,B1;;;;;;;;;;;;
1364,Je voudrais la cl√© s'il vous pla√Æt.,A1;;;;;;;;;;;;
"1365,""Lucie entama d'un air brave sa cavatine en sol majeur";" elle se plaignait d'amour, elle demandait des ailes."",C2";;;;;;;;;;;
1366,La science en fait partie.,B1;;;;;;;;;;;;
"1367,""Affirmant cela, j'entends d√©j√† les ayatollahs du coq au vin, les sermonneurs de la sauce b√©arnaise, les adeptes de la sole meuni√®re se dresser tel un seul homme brandissant leur Gault et Millau et leur Michelin."",C1";;;;;;;;;;;;
"1368,""Tu peux assister √† des cours de danse, de hockey, et de gym."",A1";;;;;;;;;;;;
1369,Il faut inciter la population √† refuser les pailles en plastique.,B2;;;;;;;;;;;;
1370,Qu'est-ce qu'ils font ?,A1;;;;;;;;;;;;
"1371,""Si vous me dites o√π vous avez pass√© l'hiver, je vous donnerai une grande somme d'argent."""""",A2";;;;;;;;;;;;
1372,Un automobiliste a √©t√© arr√™t√© pour avoir br√ªl√© un feu rouge.,B1;;;;;;;;;;;;
"1373,""Quel type de logement cherchez-vous: un appartement, une maison?"",B1";;;;;;;;;;;;
1374,L'√©pid√©mie de coronavirus nous contraint √† √©prouver l'incertain de nos existences comme une d√©gradation provisoire.,C2;;;;;;;;;;;;
1375,Vous pleuriez beaucoup. Pourquoi ?,A2;;;;;;;;;;;;
"1376,""Je te conseille vraiment la Brasserie du M√©tro qui est mon restaurant pr√©f√©r√©, tu ne le regretteras pas si tu y vas"",B1";;;;;;;;;;;;
"1377,""La dame du premier √©tage, sans doute la m√™me qui m'a parl√© au t√©l√©phone, me dit que Monsieur Lindon m'attend dans son bureau."",B1";;;;;;;;;;;;
"1378,""En quittant chaque eÃÅtape, mes enfants dessinaient le lieu ou une personne qu'ils y avaient rencontreÃÅe"",C2";;;;;;;;;;;;
"1379,""Il sut comment poursuivre dans les pr√©s les poulains √† demi sauvages, comment les approcher en secret, les surprendre d'un saut et les maintenir par force, les par la fatigue."",B2";;;;;;;;;;;;
1380,Le cheval arriva au galop et sauta par-dessus la cl√¥ture.,B2;;;;;;;;;;;;
"1381,""Comme ing√©nieur et inventeur, L√©onard d√©veloppe des id√©es tr√®s en avance sur son temps, des prototypes d'avion, d'h√©licopt√®re, de sous-marin et m√™me d'automobile."",C1";;;;;;;;;;;;
"1382,""Elle s'emplissait le coeur de ces lamentations m√©lodieuses qui se tra√Ænaient √† l'accompagnement des contrebasses, comme des cris de naufrag√©s dans le tumulte d'une temp√™te."",C1";;;;;;;;;;;;
"1383,""Pour lutter contre les anglicismes, la Commission g√©n√©rale de terminologie et de n√©ologie recommande des termes fran√ßais, qui sont parfois peu usit√©s."",C1";;;;;;;;;;;;
"1384,""Ah oui, exactement comme moi !"",A2";;;;;;;;;;;;
"1385,""C'est un petit appartement, sans beaucoup de confort, mais pr√®s du centre-ville."",B1";;;;;;;;;;;;
"1386,""C'est le cas √† Nowra, √† l'ouest de Sidney, o√π notre envoy√©e sp√©ciale Murielle Paradon a pu rencontrer un couple de sexag√©naires qui a trouv√© refuge dans sa voiture"",B1";;;;;;;;;;;;
1387,La d√©cision finale sera prise lors de la prochaine conf√©rence √† Buenos Aires.,C1;;;;;;;;;;;;
1388,Nous avons voulu visiter le mus√©e et nous avons d√ª payer l'entr√©e.,B1;;;;;;;;;;;;
"1389,""Elle m'occupait sans cesse : je formais mille projets ";" j'inventais mille moyens de conqu√™te, avec cette fatuit√© sans exp√©rience qui se croit s√ªre du succ√®s parce qu'elle n'a rien essay√©."",C2";;;;;;;;;;;
"1390,""Le soir venu, il faut rentrer en prenant le meÃÇme chemin que le matin"",A2";;;;;;;;;;;;
1391,Les nominations pr√©sidentielles ont besoin de 51 voix pour √™tre approuv√©es par le S√©nat.,B2;;;;;;;;;;;;
1392,J'aime beaucoup l'√©cole,A1;;;;;;;;;;;;
"1393,""Le respect, l'√©galit√© , c'est ce que veulent les jeunes."",A2";;;;;;;;;;;;
1394,Je mettrai la tasse sur la table.,A1;;;;;;;;;;;;
"1395,""Comme leurs enfants, en somme, auxquels ces jeunes seniors ressemblent furieusement."",C1";;;;;;;;;;;;
"1396,""La m√©chante femme n'y retournera s√ªrement pas."""" Le d√©mon partit bien vite, et il se pr√©cipita dans le trou, o√π, h√©las, il retrouva la m√©chante femme."",B1";;;;;;;;;;;;
1397,On doit aider les petits pour y arriver.,A2;;;;;;;;;;;;
1398,Ce com√©dien joua dans plusieurs pi√®ces que mon fr√®re eut √©crites.,C2;;;;;;;;;;;;
1399,Je saute et vous n'aurez jamais les plans !,A2;;;;;;;;;;;;
"1400,""Et l√† en revanche, √ßa pourrait me servir."",A1";;;;;;;;;;;;
1401,Malheureusement sa conduite √©tait plut√¥t noble et g√©n√©reuse que tendre.,B2;;;;;;;;;;;;
1402,Mais que fait Jules ?,A1;;;;;;;;;;;;
"1403,""Tant√¥t une tendance l'emporte, tant√¥t l'autre ";" mais jamais, parmi tant d'arguments, jamais ne se produit la question essentielle."",C2";;;;;;;;;;;
"1404,""Mon fils a de bonnes notes en fran√ßais, c'est sa mati√®re pr√©f√©r√©e"",B1";;;;;;;;;;;;
"1405,""Sombre constat, d√©cid√©ment, qui devrait interpeller les pouvoirs publics, en grande partie responsables de cet √©tat de fait, quelle que soit la couleur politique des gouvernements successifs."",C2";;;;;;;;;;;;
"1406,""Puis je me bagarrais avec Daffy, mon canard en peluche, je machouillais mon os qui couine ou je chantais √† runisson avec la radio de la voisine"",C1";;;;;;;;;;;;
1407,Je ne sais pas si j'ai assez d'argent pour vous accompagner,A2;;;;;;;;;;;;
"1408,""Dans les Cara√Øbes anglophones, 25 % des hommes et 50 % des femmes sont d√©j√† ob√®ses."",C1";;;;;;;;;;;;
1409,Sa voiture rouge est tr√®s rapide.,A1;;;;;;;;;;;;
