id,sentence,difficulty;;;;;;;;;;;;
"0,""Les co√ªts kilom√©triques r√©els peuvent diverger sensiblement des valeurs moyennes en fonction du moyen de transport utilis√©, du taux d'occupation ou du taux de remplissage, de l'infrastructure utilis√©e, de la topographie des lignes, du flux de trafic, etc."",C1";;;;;;;;;;;;
"1,""Le bleu, c'est ma couleur pr√©f√©r√©e mais je n'aime pas le vert!"",A1";;;;;;;;;;;;
2,Le test de niveau en fran√ßais est sur le site Internet de l'√©cole.,A1;;;;;;;;;;;;
3,Est-ce que ton mari est aussi de Boston?,A1;;;;;;;;;;;;
"4,""Dans les √©coles de commerce, dans les couloirs de places financi√®res, il arrive aujourd'hui de croiser de jeunes adultes de 20 ou 25 ans qui pr√©voient d'ouvrir une maison d'h√¥tes """"dans une quinzaine d'ann√©es""""."",B1";;;;;;;;;;;;
5,voil√† une autre histoire que j'ai beaucoup aim√©e.,A2;;;;;;;;;;;;
6,Les m√©decins disent souvent qu'on doit boire un verre de vin rouge apr√®s les repas.,A2;;;;;;;;;;;;
"7,""Il est particuli√®rement observ√© chez les personnes ayant un besoin de popularit√© d√©velopp√©, qui consid√®rent d√®s lors le moindre signal du smartphone comme un possible indicateur de leur degr√© de popularit√©."",B2";;;;;;;;;;;;
8,J'ai retrouv√© le plaisir de manger un oeuf √† la coque,A2;;;;;;;;;;;;
"9,""Nous allons bien, nous habitons dans une petite maison ancienne avec un tr√®s beau jardin"",B1";;;;;;;;;;;;
10,Bonjour et bonne ann√©e.,A1;;;;;;;;;;;;
11,La presse s'est abondamment fait l'√©cho des effets secondaires ressentis par les soignants de moins de 65 ans.,B2;;;;;;;;;;;;
"12,""Pour que le rocher s'ouvre, il faut le toucher avec un brin d'herbe."",B1";;;;;;;;;;;;
13,J'habite une belle ville dans le nord de la France.,A1;;;;;;;;;;;;
"14,""Certes il doit r√©pondre aux go√ªts du consommateur, mais aussi aux capacit√©s de son porte-monnaie."",B2";;;;;;;;;;;;
"15,""Ma timidit√© me quittait d√®s que je m'√©loignais d'Ell√©nore ";" je reprenais alors mes plans habiles et mes profondes combinaisons : mais √† peine me retrouvais-je aupr√®s d'elle, que je me sentais de nouveau tremblant et troubl√©."",C2";;;;;;;;;;;
16,Je pense que fr√©quenter les galeries est la meilleure mani√®re d'√©duquer son oeil √† l'art contemporain.,B2;;;;;;;;;;;;
"17,""Le soir, je me cuche t√¥t parce que je dois √™tre toujours en bonne forme."",A1";;;;;;;;;;;;
"18,""La m√®re de Rapha√´l et de Vanessa exprime sa satisfaction : depuis que ses enfants poss√®dent un portable, """"√ßa a lib√©r√© ma ligne"""", d√©clare-t-elle."",B2";;;;;;;;;;;;
19,Je ne fais pas grand-chose √† la maison.,A2;;;;;;;;;;;;
20,Elle ajoute qu'une interdiction totale est impossible √† g√©rer.,B2;;;;;;;;;;;;
"21,""Sans plus d'h√©sitation, il tourna vers la gauche ";" son pas sonnait sur la terre durcie, et ce bruit cadenc√©, monotone, assoupissait en le ber√ßant, le tumulte de son esprit."",C2";;;;;;;;;;;
"22,""Comme le signale l'expression """"lingua franca"""", le fran√ßais a √©t√© pendant tr√®s longtemps la langue internationale, eu √©gard √† notre rayonnement politique aussi bien que culturel"",C2";;;;;;;;;;;;
23,Je ne t'ai pas t√©l√©phon√© parce que j'ai eu trop de travail.,B1;;;;;;;;;;;;
24,C'est peut-√™tre √ßa que vous cherchez ?,A2;;;;;;;;;;;;
"25,""Qu'est-ce qui peut bien poser probl√®me dans ces petits livrets pourtant plut√¥t attractifs pour que seuls 23, 4 % de leurs d√©tenteurs arrivent au bout ?"",C2";;;;;;;;;;;;
26,Je consulte d'habitude ma messagerie. Et puis je prends un caf√©.,A1;;;;;;;;;;;;
27,Nous sommes en train de d√Æner.,A2;;;;;;;;;;;;
"28,""En fait, je trouve que l'√©ducation est une bonne chose."",B1";;;;;;;;;;;;
29,As-tu besoin de quelque chose?,A1;;;;;;;;;;;;
"30,""Perp√©tuel clandestin, c'est muni d'un faux titre de s√©jour, photocopie de la carte de r√©sident d'un copain-complice, qu'il avait ensuite sillonn√© l'Hexagone, au bon vouloir d'employeurs peu scrupuleux."",C1";;;;;;;;;;;;
"31,""Le mariage mixte appara√Æt comme le lieu privil√©gi√© ou les cultures s'affrontent, dialoguent et se fondent."",B2";;;;;;;;;;;;
"32,""Assis en terrasse dans le quartier touristique du Vieux Lyon, James sirote une limonade bien fra√Æche"",B2";;;;;;;;;;;;
"33,""La chronologie antique ne prend sens que sur un large pourtour de la M√©diterran√©e, de m√™me que ce d√©coupage spatial n'est pertinent comme entit√© g√©ographique que durant cette p√©riode pendant laquelle la mer int√©rieure n'est pas v√©cue comme une limite."",C2";;;;;;;;;;;;
"34,""En voici un des moins obscurs : """"Plus nous devenons ma√Ætres de la biosph√®re, plus nous en devenons d√©pendants ";" plus nous la d√©gradons, plus nous d√©gradons nos vies5."",C2";;;;;;;;;;;
"35,""C'est le d√©but de troubles qui se poursuivent et s'√©tendent au reste du territoire tout au long du mois de septembre les fameuses """"Journ√©es de septembre"""" amplifi√©s le refus de Guillaume 1er de consid√©rer les revendications des insurg√©s"",B2";;;;;;;;;;;;
36,Les filles s'√©taient fait des colliers en fruits rouges qui ressemblaient √† des perles.,B2;;;;;;;;;;;;
37,Je reste avec toi.,A1;;;;;;;;;;;;
38,Un revenu devient donc une n√©cessit√© pour que l'Homme puisse acc√©der √† la satisfaction d'avoir combl√© ses d√©sirs,C2;;;;;;;;;;;;
39,Tu mangeas les petits fruits d√®s que tu les eus cueillis,C2;;;;;;;;;;;;
"40,""Ben, on est tous d√©bord√©s quoi."",A1";;;;;;;;;;;;
"41,""Un petit gar√ßon : Ben trois dans un nid et dans l'autre, y'en a deux"",A2";;;;;;;;;;;;
42,J'ai √©t√© en forme toute la matin√©e.,A2;;;;;;;;;;;;
"43,""L'ordinateur peut aussi r√©pondre √† des interruptions qui lui permettent d'ex√©cuter des programmes de r√©ponses sp√©cifiques √† chacune, puis de reprendre l'ex√©cution s√©quentielle du programme interrompu."",C2";;;;;;;;;;;;
44,Il a plu et j'ai attendu l'autobus.,A2;;;;;;;;;;;;
"45,""Dans d'autres cas il s'agit de limites relatives, bas√©es sur un taux de croissance d√©mographique de r√©f√©rence, valables l√† aussi uniquement hors centres ou pond√©r√©es en fonction du degr√© de centralit√©."",C2";;;;;;;;;;;;
46,C'est bien !,A1;;;;;;;;;;;;
"47,""En 2007, moins de 8% des d√©chets des entreprises ont fait l'objet d'une collecte s√©lective."",B2";;;;;;;;;;;;
48,Les m√©decins des donneurs vous conseilleront volontiers dans un tel cas vous renseigneront par rapport aux dons de sang.,C1;;;;;;;;;;;;
49,Le plus inqui√©tant c'est que la Scandinavie avait d√©j√† battu des records de chaleur pendant l'√©t√© 2018,A2;;;;;;;;;;;;
50,J'aime le ski.,A1;;;;;;;;;;;;
"51,""""""Malheureusement, il semble d√©sormais √©vident qu'il n'y a pas de voie pour obtenir une confirmation"""", a √©crit Neera Tanden √† Joe Biden en retirant sa candidature"",B2";;;;;;;;;;;;
52,Pourquoi l'oisillon se retrouve-t-il seul dans la for√™t ?,A1;;;;;;;;;;;;
53,Elle est n√©e quel jour ?,A1;;;;;;;;;;;;
"54,""Il existe effectivement, des √™tres humains qui poss√®dent une quantit√© de pouvoir importante et qui contraignent l'humanit√© √† travailler en cr√©ant un cercle vicieux qui fait du travail une n√©cessit√© pour acc√©der √† ses propres d√©sirs"",C2";;;;;;;;;;;;
55,Une bouch√©e de : cette expression fait r√©f√©rence √† la quantit√© d'un aliment qu'on met dans la bouche en une fois.,B1;;;;;;;;;;;;
"56,""Si tu respectait les indications plus s√©rieusement, tu trouverais plus facilement ton chemin √† travers ces ruelles."",B2";;;;;;;;;;;;
"57,""Aussit√¥t que Julie eut d√©couvert la v√©rit√©, elle fut furieuse"",C2";;;;;;;;;;;;
58,Pile au moment o√π on a le plus besoin de r√©confort,A2;;;;;;;;;;;;
"59,""Le train, en son temps, √©tait √©galement craint. Brigitte Munier Les robots suscitent l'enthousiasme des Occidentaux, mais aussi leur angoisse: au lieu de les concevoir comme de simples outils ou, √† la mani√®re japonaise, tels d'amicaux auxiliaires, ils craignent des comp√©titeurs mena√ßant leur avenir."",C1";;;;;;;;;;;;
60,Je viens d'emm√©nager dans ma nouvelle maison.,A2;;;;;;;;;;;;
"61,""Et cette ann√©e, √ßa d√©file !"",B1";;;;;;;;;;;;
"62,""Compte tenu de cette configuration, cette zone est peu adapt√©e √† des mesures de terrain pour limiter la diffusion des campagnols terrestres ";" les axes routiers ne repr√©sentant pas une barri√®re tr√®s forte pour cette esp√®ce, on peut aussi penser qu'un tel r√©sultat est un art√©fact d√ª √† la coupure artificielle d'une seule tache de prairie."",C1";;;;;;;;;;;
"63,""Apr√®s m√ªre r√©flexion, la Commission europ√©enne a eu une id√©e brillante: s'attaquer √† un nouveau chantier, qui avait jusque-l√† bizarrement √©chapp√© √† sa sagacit√© l√©gendaire."",C1";;;;;;;;;;;;
"64,""Avec de l'exp√©rience, le t√©l√©vendeur peut devenir animateur d'un p√¥le de t√©l√©vendeurs, superviseur d'√©quipe, chef de plateau."",B1";;;;;;;;;;;;
"65,""Et toi, qu'est-ce que tu vas faire ?"",A2";;;;;;;;;;;;
66,Les valorisations boursi√®res des soci√©t√©s Internet comme AMAZON,C2;;;;;;;;;;;;
"67,""Sur d'autres, on entendait une s√©rie de d√©tonations, tandis que des contestataires scandaient: """"notre r√©volte doit r√©ussir""""."",C1";;;;;;;;;;;;
68,Les baby-boomers en sont convaincus: tout peut recommencer √† 50 ans.,C1;;;;;;;;;;;;
"69,""Rien n'√©tait si beau, si leste, si brillant, si bien ordonn√© que les deux arm√©es."",B1";;;;;;;;;;;;
70,Comment t'appelles-tu ?,A1;;;;;;;;;;;;
"71,""Largu√© par la sonde europ√©enne Rosetta, le petit robot avait atterri mercredi en fin d'apr√®s-midi sur le noyau de la com√®te Tchourioumov-Gu√©rassimenko, une premi√®re de l'histoire spatiale."",B2";;;;;;;;;;;;
"72,""Elle pendit son linge au dossier d'une chaise, elle demeura debout, tournant, examinant les meubles, frapp√©e d'une telle stupeur, que ses larmes ne coulaient plus "; il lui restait un sou sur les quatre sous gard√©s pour le lavoir. Puis, entendant rire √† la fen√™tre √âtienne et Claude, d√©j√† consol√©s, elle s'approcha, prit leurs t√™tes sous ses bras, s'oublia un instant devant cette chauss√©e grise, o√π elle avait vu, le matin, s'√©veiller le peuple ouvrier, le travail g√©ant de Paris ; √† cette heure, le pav√© √©chauff√© par les besognes du jour allumait une r√©verb√©ration ardente au-dessus de la ville, derri√®re le mur de l'octroi ;" c'√©tait sur ce pav√©, dans cet air de fournaise, qu'on la jetait toute seule avec les petits et elle enfila d'un regard les boulevards ext√©rieurs, √† droite, √† gauche, s'arr√™tant aux deux bouts, prise d'une √©pouvante sourde, comme si sa vie, d√©sormais, allait tenir l√†, entre un abattoir et un h√¥pital."",C2";;;;;;;;;
"73,""Le s√©rum, qui a p√¢ti de la comparaison avec ses concurrents Pfizer et Moderna, est d√©sormais consid√©r√© comme aussi efficace pour pr√©venir le risque d'hospitalisation."",C1";;;;;;;;;;;;
"74,""J'ai identifi√© trois peurs fondamentales du robot: la crainte instinctive du m√©tal contre la chair, la crainte soci√©tale, presque d√©sesp√©r√©e du robot qui va voler le travail de l'homme, et, enfin, la crainte identitaire de voir le robot nous d√©passer en capacit√©s intellectuelles ou autres."",C2";;;;;;;;;;;;
75,Mais d'autres pourront pr√©f√©rer L'Assassin des √©checs ou Les Annales du Kangourou (Editions du Kangourou) .,C2;;;;;;;;;;;;
76,Vous ferez de la randonn√©e ?,B1;;;;;;;;;;;;
77,il y a plus de 50 pays francophones !,A1;;;;;;;;;;;;
78,Ils ont d√©j√† l'obligation de les ramener chez eux.,B1;;;;;;;;;;;;
"79,""Un autre : Oui, on leur a bien donn√© des noms"",A2";;;;;;;;;;;;
80,Vous joindrez √† votre formulaire les pi√®ces justificatives et documents sous format num√©rique.,B2;;;;;;;;;;;;
"81,""Merci, bon voyage."",A1";;;;;;;;;;;;
"82,""Ce geste, presque insensible, lui fit courir, de la t√™te aux pieds, un grand frisson sur la peau, et, se tournant vivement, il se jeta sur elle, cherchant la bouche avec ses l√®vres et la chair nue avec ses mains."",C2";;;;;;;;;;;;
83,Il clabaude aux esgourdes des blaireaux enfarin√©s et des tordus pasteuris√©s.,C2;;;;;;;;;;;;
"84,""Avec sa nouvelle compagne de quatorze ans sa cadette, il dit """"vivre une renaissance""""."",C1";;;;;;;;;;;;
"85,""Entre ceux qui ne jurent que par l'introduction de l'informatique dans l'enseignement obligatoire, et ceux qui ont peur que l'on veuille transformer le primaire en une grande √©cole d'informatique, il existe pourtant des pistes pour initier les enseignants et favoriser un passage du p√©riscolaire au scolaire, sans avoir √† attendre une r√©forme du socle commun qui prendra des ann√©es."",C2";;;;;;;;;;;;
"86,""Parmi les acteurs du commerce √©quitable, il faut distinguer les organismes """"labellisateurs"""", qui certifient des fili√®res d'importation par produit, et les importateurs - grossistes, d√©taillants ou r√©seaux de boutiques, comme Artisans du monde -, qui ont leurs propres contacts avec les producteurs et s'autocontr√¥lent, faute de mieux."",C1";;;;;;;;;;;;
87,Elle peut donc ouvrir d'autres r√©flexions et finalement devenir tr√®s enrichissante.,B2;;;;;;;;;;;;
"88,""Ce paysan pleurait et pr√©tendait qu'on lui avait tout pris ";" Fabrice lui donna un √©cu, et il trouva de l'avoine."",B2";;;;;;;;;;;
"89,""La premi√®re limite est que les instruments de contingentement spatial pris en compte donnent une id√©e de la ma√Ætrise """"potentielle"""" de l'urbanisation, ma√Ætrise d√©rivant des possibilit√©s fournies par le cadre l√©gal et strat√©gique dont chaque canton s'est dot√©."",C2";;;;;;;;;;;;
90,Le petit chat a plu √† mes parents,A2;;;;;;;;;;;;
91,Se pr√©munir contre l'alt√©ration des donn√©es et avoir la certitude qu'elles n'ont pas √©t√© modifi√©es lors de leur stockage ou de leur traitement contribue √† la qualit√© des prises de d√©cisions bas√©es sur celles-ci.,C2;;;;;;;;;;;;
"92,""[.] Nous sommes des joueurs/jou√©s3""""."",B2";;;;;;;;;;;;
"93,""Quand j'ai lu, j'ai d√©couvert de nouvelles choses surprenantes sur les locataires qui occupaient l'appartement."",B1";;;;;;;;;;;;
94,Vous avez dit la seule chose intelligente !,A2;;;;;;;;;;;;
95,Mon ami ne r√©pond pas au t√©l√©phone.,A1;;;;;;;;;;;;
96,Mon freÃÄre Patrice est plus jeune que moi,A2;;;;;;;;;;;;
"97,""Ils sont en vacances, il n'y a que nous sur cette partie de l'√Æle."",B1";;;;;;;;;;;;
"98,""Quand il y a des nuages avec de la neige qui tombe, c'est qu'il va neiger et qu'il peut y avoir du brouillard, des risques de cong√©lation, de la glace et que la temp√©rature sera tr√®s basse"",B1";;;;;;;;;;;;
"99,""Un escalier nous conduisit √† une large coursive en hauteur qui faisait le tour du b√¢timent, desservant une succession de bureaux."",C2";;;;;;;;;;;;
"100,""Que vous cherchiez une simple annonce ou un recruteur, vous √™tes s√ªr de ne rater aucune offre d'emploi gr√¢ce √† notre syst√®me d'alerte personnalis√©."",B2";;;;;;;;;;;;
"101,""√áa nous a donc co√ªt√© de l'argent, s'√©nerve-t-elle."",B1";;;;;;;;;;;;
102,Vous vous appelez comment ?,A1;;;;;;;;;;;;
"103,""Fabrice, √† peine √¢g√© de seize ans, repr√©sentait fort bien le chef de la maison."",B2";;;;;;;;;;;;
"104,""Oui, je suis √† Paris depuis vingt jours √† peine."",A1";;;;;;;;;;;;
"105,""L'apprentissage du code et plus largement d'une culture g√©n√©rale du num√©rique √† l'√©cole est une mesure r√©clam√©e depuis longtemps par l'Acad√©mie des Sciences, soutenue par des acteurs qui comptent dans le secteur num√©rique, comme la Cnil ou le Conseil national du num√©rique, et qui figure m√™me dans une proposition de loi de la d√©put√©e UMP Laure de la Raudi√®re."",C2";;;;;;;;;;;;
106,Pourquoi ne pas avoir donn√© la serviette alors que tu avais d√©j√† les plans ?,B1;;;;;;;;;;;;
"107,""Quand je rentre, je demande √† mes parents si je peux t'appeler pour avoir de tes nouvelles."",A2";;;;;;;;;;;;
"108,""L'important, √©videmment, pour les contribuables europ√©ens qui voudraient annuler leur dette, c'est que chacun des cr√©diteurs, des cr√©anciers soit trait√© de la m√™me fa√ßon."",B2";;;;;;;;;;;;
"109,""M√™me l'ambassadeur birman aux Nations unies, Kyaw Moe Tun, a rompu de mani√®re spectaculaire avec les g√©n√©raux putschistes la semaine derni√®re en appelant √† """"mettre fin au coup d'Etat""""."",C1";;;;;;;;;;;;
110,Le directeur aurait donn√© de nouvelles consignes au personnel.,B2;;;;;;;;;;;;
111,Vos regards m'observent.,C2;;;;;;;;;;;;
112,De nombreux auteurs ont sp√©cul√© sur les diff√©rents aspects de la personnalit√© de L√©onard.,C1;;;;;;;;;;;;
"113,""Les cons√©quences sur la nature sont gravissimes, notamment sur les oc√©ans qui contiendraient selon la revue am√©ricaine Science plus de 110 millions de tonnes de d√©chets plastiques."",B2";;;;;;;;;;;;
"114,""Si sept millions de citadins r√™vent de refaire leur vie aux champs, tous ne passent pourtant pas √† l'acte. """"Il y a toujours un √©v√©nement d√©clencheur"""", constate la directrice de Changer tout."",B2";;;;;;;;;;;;
"115,""Mon p√®re, bien qu'il observ√¢t strictement les convenances ext√©rieures, se permettait assez fr√©quemment des propos l√©gers sur les liaisons d'amour : il les regardait comme des amusements, sinon permis, du moins excusables, et consid√©rait le mariage seul sous un rapport s√©rieux."",C2";;;;;;;;;;;;
116,Apr√®s tout que lui offre-t-elle √† part de l'ennui et une grosse boule d'angoisse au creux du ventre ?,A2;;;;;;;;;;;;
117,Leur pavillon mitoyen √† Paris √©tait pratiquement neuf quand ils l'avaient achet√©.,B2;;;;;;;;;;;;
118,L'√©migration galicienne sous-tend l'√©volution du peuplement et l'explique en grande partie.,C1;;;;;;;;;;;;
119,Ces tani√®res se fondent dans la nature pour √™tre quasiment invisibles.,C1;;;;;;;;;;;;
120,Les hommes se croient libres alors qu'ils sont contraints ou d√©termin√©s par leur nature,C2;;;;;;;;;;;;
121,Il fallait radicalement changer de cap en choisissant la cuisine de qualit√© accessible au plus grand nombre au lieu de quoi nous nous sommes repli√©s sur des valeurs s√ªres d√©sormais d√©su√®tes et indigestes.,B2;;;;;;;;;;;;
"122,""Nos proph√©ties disent que tant qu'il y aura des bisons sauvages, nous survivrons."",C1";;;;;;;;;;;;
"123,""Je m'appelle Camille et quand j'eÃÅtais enfant, j'avais des reÃÇves plein la teÃÇte"",A2";;;;;;;;;;;;
"124,""R√©affirmant que le S√©nat ne s'√©tait livr√© √† aucun chantage contrairement aux all√©gations du rapporteur pour l'Assembl√©e nationale, il a, au contraire, affirm√© que la position de la Haute Assembl√©e relevait d'une conception coh√©rente et constante de la soci√©t√©."",C1";;;;;;;;;;;;
"125,""Quelques coups de battoir partaient encore, espac√©s, au milieu des rires adoucis, des conversations qui s'emp√¢taient dans un bruit glouton de m√¢choires "; tandis que la machine √† vapeur, allant son train, sans repos ni tr√™ve, semblait hausser la voix, vibrante, ronflante, emplissant l'immense salle. Mais pas une des femmes ne l'entendait ; c'√©tait comme la respiration m√™me du lavoir, une haleine ardente amassant sous les poutres du plafond l'√©ternelle bu√©e qui flottait. La chaleur devenait intol√©rable ; des rais de soleil entraient √† gauche, par les hautes fen√™tres, allumant les vapeurs fumantes de nappes opalis√©es, d'un gris rose et d'un gris bleu tr√®s tendre ; et, comme des plaintes s'√©levaient, le gar√ßon Charles allait d'une fen√™tre √† l'autre, tirait des stores de grosse toile ;" ensuite, il passa de l'autre c√¥t√©, du c√¥t√© de l'ombre, et ouvrit des vasistas."",C2";;;;;;;
126,Que du bonheur !,A2;;;;;;;;;;;;
127,On semble oublier que le personnel en milieu scolaire applique d√©j√† cette mesure.,B2;;;;;;;;;;;;
"128,""Une association de promotion et de d√©veloppement de l'apprentissage en ligne note que si la calculatrice a """"supplant√© le calcul mental y compris pour des op√©rations basiques, et que l'utilisation d'un ordinateur reli√© √† internet pourrait ais√©ment remplacer une partie de notre m√©moire, les op√©rations basiques ont ont √©t√© m√©moris√©es en amont et c'est gr√¢ce √† cette assimilation de connaissances basiques que l'apprenant peut utiliser la calculatrice""""."",C1";;;;;;;;;;;;
"129,""Tous, sauf un petit oiseau."",A1";;;;;;;;;;;;
130,Sa sant√© s'est d√©grad√©e √† cause d'une infection s√©v√®re et ses jours sont compt√©s.,B2;;;;;;;;;;;;
131,La chose me vient d'√™tre certifi√©e.,B1;;;;;;;;;;;;
132,La nouvelle a fait grand bruit: cette affaire de couvre-feu cache en fait une angoisse plus profonde.,B1;;;;;;;;;;;;
133,J'ai le plaisir de vous annoncer que votre demande d'inscription √† l'universit√© de Strasbourg en premi√®re ann√©e de master Sciences et Soci√©t√© a √©t√© accept√©e,B1;;;;;;;;;;;;
"134,""Une large majorit√© de fran√ßais est favorable √† la modification du calcul de la retraite des fonctionnaires dans le cadre de la r√©forme en pr√©paration, selon un sondage publi√© vendredi"",C2";;;;;;;;;;;;
"135,""Aussi, les jeunes heureux r√©ussissent √† acheter leur autonomie et leur tranquillit√© par une r√©ussite au lyc√©e qui ne les d√©vore pas."",B2";;;;;;;;;;;;
"136,""Une fois qu'il a tout fini, TheÃÅo peut enfin aller jouer et s'amuser avant de diÃÇner avec ses parents."",A2";;;;;;;;;;;;
"137,""La cinquantaine est un bel √¢ge: on gagne en profondeur et en bienveillance, constate Philippe Wattier."",C1";;;;;;;;;;;;
138,Les quelques chiffres publi√©s √† ce jour donnent une id√©e de la d√©gradation du climat entre les √©l√®ves des deux sexes.,C1;;;;;;;;;;;;
"139,""Mais une diff√©rence appara√Æt en fin de cursus scolaire, les gar√ßons prenant dans ce dernier domaine un avantage sur les filles."",B2";;;;;;;;;;;;
"140,""Le vert par exemple, est la couleur de l'herbe et des feuilles des arbres."",A1";;;;;;;;;;;;
141,Elle ne ressemble √† aucune des filles que je connais.,A2;;;;;;;;;;;;
"142,""Les masses liquides transportent les plus grandes esp√®ces connues de mammif√®res, et peut-√™tre rec√®lent-elles des mollusques d'une incomparable taille, des crustac√©s effrayants √† contempler, tels que seraient des homards de cent m√®tres ou des crabes pesant deux cents tonnes !"",B2";;;;;;;;;;;;
"143,""Force est de constater que l'√©cart se creuse entre les pays en d√©veloppement qui, progressivement, sortent de la p√©nurie chronique, et ceux qui stagnent ou r√©gressent dans leur combat contre la faim."",C1";;;;;;;;;;;;
"144,""Une huiti√®me √©dition domin√©e par le duel au sommet avec Alex Thomson, une course poursuite men√©e par Armel depuis le 23 novembre dernier, quarante-sept jours de haute tension qui se terminent aujourd'hui"",C1";;;;;;;;;;;;
145,Pourquoi on ne peut pas entrer dans la chambre ?,A1;;;;;;;;;;;;
146,√Ä tr√®s bient√¥t.,A2;;;;;;;;;;;;
"147,""C'√©tait cette comparaison, tacitement et inlassablement r√©p√©t√©e dans une m√™me toile, qui y introduisait cette puissante et multiforme unit√©, cause, parfois non clairement aper√ßue par eux, de l'enthousiasme qu'excitait chez certains amateurs la peinture d'Elstir."",C2";;;;;;;;;;;;
148,Soyons s√©rieux,B2;;;;;;;;;;;;
149,Bienheureux le quidam que voil√† d√©barrass√© de cette peur originelle d'√©chouer et de faire faux,C2;;;;;;;;;;;;
150,Je prends le train.,A1;;;;;;;;;;;;
"151,""C'est dans sa lettre √† Schuller, extraite de sa Correspondance, que Spinoza d√©nonce l'illusion du libre arbitre"",C2";;;;;;;;;;;;
152,Je prends mon petit-d√©jeuner dans la cuisine.,A1;;;;;;;;;;;;
153,Il nous arrive de proc√©der de cette fa√ßon de temps en temps.,A2;;;;;;;;;;;;
"154,""Alors qu'au cours du Pal√©olithique, la diffusion avait fractionn√© l'√©coum√®ne en petits groupes, la tendance depuis la fin de la derni√®re glaciation est √† l'√©paississement des relations dans l'Ancien Monde, par augmentation des effectifs et par tissage d'interconnexions."",C2";;;;;;;;;;;;
"155,""Or, la croissance d√©mographique concerne surtout les pays en voie de d√©veloppement, qui connaissent aujourd'hui des probl√®mes de sous-alimentation et de mauvaise alimentation."",C1";;;;;;;;;;;;
156,Je suis dans ma chambre.,A1;;;;;;;;;;;;
157,Une ind√©niable s√©r√©nit√© se refl√©tait sur ses traits.,C2;;;;;;;;;;;;
158,Le jour de l'An correspond au 1 janvier.,A1;;;;;;;;;;;;
"159,""√âtant f√©ru d'art, Yves Saint Laurent a constitu√©, au fil des ann√©es, une importante collection d'objets pr√©cieux et de peintures qui ont inspir√© certaines de ses cr√©ations."",C1";;;;;;;;;;;;
160,Ils suivaient une sente creuse que dominait des deux c√¥t√©s un talus de six pieds de haut.,C2;;;;;;;;;;;;
