id,sentence,difficulty;;;;;;;;;;;;
"2454,""Et dans cette ville inerte, cette foule criarde si √©tonnamment pass√©e √† c√¥t√© de son cri comme cette ville √† c√¥t√© de son mouvement, de son sens, sans inqui√©tude, √† c√¥t√© de son vrai cri, le seul qu'on e√ªt voulu l'entendre crier parce qu'on le sent sien lui seul ";" parce qu'on le sent habiter en elle dans quelque refuge profond d'ombre et d'orgueil, dans cette ville inerte, cette foule √† c√¥t√© de son cri de faim, de mis√®re, de r√©volte, de haine, cette foule si √©trangement bavarde et muette."",C2";;;;;;;;;;;
2455,Nous sommes normalement √† un moment de l'ann√©e o√π ce genre de ph√©nom√®nes est en train de diminuer,A2;;;;;;;;;;;;
2456,J'ai h√¢te !,A1;;;;;;;;;;;;
2457,Il agite son petit nez rose quand il me voit Ma grand-m√®re fait des g√¢teaux tous les jours,A2;;;;;;;;;;;;
"2458,""Un n√©ant √† l'√©gard de l'infini, un tout √† l'√©gard du n√©ant, un milieu entre rien et tout, infiniment √©loign√© de comprendre les extr√™mes."""" Notre Pascal est celui de l'homme situ√© entre deux infinis, m√©lange de folie et de sagesse."",C2";;;;;;;;;;;;
"2459,""Dans ma famille, on adore go√ªter les sp√©cialit√©s locales alors on a tout essay√©, de la choucroute √† la tarte flamb√©e en passant par les kouglofs"",B1";;;;;;;;;;;;
2460,Je suis nouveau ici.,A1;;;;;;;;;;;;
"2461,""Oui, je me doute."",A1";;;;;;;;;;;;
"2462,""Florian Kirchner, charg√© du programme esp√®ces de l'ONG, rappelle les nombreux enjeux et d√©fis qui attendent notre pays, mais aussi le monde, en mati√®re de conservation et de protection faunistique et floristique."",C1";;;;;;;;;;;;
"2463,""En Allemagne, par exemple, on n'a pas cours l'apr√®s-midi, tandis que nous restons au coll√®ge jusqu'√† 17 heures."",B1";;;;;;;;;;;;
2464,Comment vas-tu ?,A1;;;;;;;;;;;;
2465,Des enfants en choeur : Des petits pois avec de la salade !,A2;;;;;;;;;;;;
"2466,""Non, dit l'un de ces messieurs, nous vous demandons si vous n'aimez pas tendrement le roi des Bulgares."",B1";;;;;;;;;;;;
"2467,""Le r√©giment √©tait compos√© de deux mille hommes ";" cela lui composa quatre mille coups de baguette, qui, depuis la nuque du cou jusqu'au cul, lui d√©couvrirent les muscles et les nerfs."",B2";;;;;;;;;;;
"2468,""Si les centaines de millions d'affam√©s de la plan√®te sont inacceptables, la situation alimentaire internationale donne pourtant, selon les sp√©cialistes, """" des signes lents mais tangibles d'am√©lioration""""."",C1";;;;;;;;;;;;
2469,Il √©tait juste un peu curieux.,A2;;;;;;;;;;;;
"2470,""Ma ch√®re Sonia, Je suis bien arriv√©e √† Londres pour ma derni√®re ann√©e d'√©tudes de marketing √† l'universit√©."",B1";;;;;;;;;;;;
2471,Plusieurs pays ont commenc√© √† appliquer les principes d'une gestion intelligente d'une ressource longtemps consid√©r√©e comme in√©puisable.,B2;;;;;;;;;;;;
2472,Il faudra bien que quelqu'un aide le petit √† le faire.,A2;;;;;;;;;;;;
2473,Le chaufffeur de bus est en retard.,A1;;;;;;;;;;;;
2474,Je ne vois aucune contradiction entre la promotion des langues r√©gionales et la d√©fense du fran√ßais,C2;;;;;;;;;;;;
"2475,""Le poids croissant du Japon, l'√©mergence des nouveaux pays industrialis√©s (NPI) et, surtout, la mont√©e en puissance spectaculaire de la Chine rappellent des r√©alit√©s beaucoup plus anciennes qu'une hi√©rarchie √©conomique entre les Occidentaux et le reste du Monde."",C2";;;;;;;;;;;;
2476,Il ne dit jamais rien qui puisse nous affecter outre mesure dans nos estimes de soi.,C1;;;;;;;;;;;;
2477,Il arrive bient√¥t.,A1;;;;;;;;;;;;
"2478,""En effet, meÃÇme si vous ne souhaitez pas acheter quelque chose, il est toujours inteÃÅressant de passer du temps dans les centres commerciaux"",B1";;;;;;;;;;;;
"2479,""Du haut de la Tour Eiffel, on peut voir les principaux monuments de Paris"",B1";;;;;;;;;;;;
2480,C'est en Italie que les deux mots sont le plus souvent associ√©s.,A2;;;;;;;;;;;;
"2481,""Quand le G20 du 15 avril d√©cide le moratoire, c'est la premi√®re fois que la Chine acceptait, dans un cadre multilat√©ral, de participer √† un moratoire."",B2";;;;;;;;;;;;
"2482,""Les yeux de Fabrice se mouill√®rent, il r√©pandit des larmes en embrassant la comtesse, mais sa r√©solution de partir ne fut pas un instant √©branl√©e."",C1";;;;;;;;;;;;
2483,Le menu est imagin√© chaque jour en fonction de ce que les chefs trouvent au march√© de Lyon.,B1;;;;;;;;;;;;
"2484,""Nous nous interrogeons sur le soutien moral et financier des pouvoirs publics √† une campagne de sensibilisation dont le message (""""Achetez du caf√© qui vous permette de dormir tranquille"""", encart publicitaire de la marque Max Havelaar France) suinte la vieille culture coloniale qui marque encore aujourd'hui nos imaginaires collectifs et notre rapport au monde: le r√¥le de l'√âtat est-il de financer des op√©rations de """"communication √©thique"""" d'enseignes multinationales?"",C1";;;;;;;;;;;;
2485,Ce sont elles qui les comptent et les mettent dans notre panier.,A2;;;;;;;;;;;;
2486,Les joueurs se furent rapidement ressaisis apr√®s la tentative d√©sastreuse pour √©galiser le score avant la mi-temps.,C1;;;;;;;;;;;;
2487,Tu n'oubliais pas ! Tu nettoyais la demeure de fond en combles.,B1;;;;;;;;;;;;
"2488,""Homme de r√©seaux, le vagabond n'a pas coup√© les liens avec le pays, qu'il maintient gr√¢ce au solide maillage des postes europ√©ennes."",C2";;;;;;;;;;;;
"2489,""Revue une fois, elle sera cette fois plus facilement accessible"""""",C1";;;;;;;;;;;;
"2490,""Selon les calculs du CNES, la batterie de Philae devait √™tre totalement d√©charg√©e vers 02h00 GMT (03h00 locales)."",B2";;;;;;;;;;;;
"2491,""Mais, quand d'un pass√© ancien rien ne subsiste, apr√©s la mort des √™tres, apr√®s la destruction des choses, seules, plus fr√®les mais plus vivaces, plus immat√©rielles, plus persistantes, plus fid√®les, l'odeur et la saveur restent encore longtemps, comme des √¢mes, √† se rappeler, √† attendre, √† esp√©rer, sur la ruine de tout le reste, √† porter sans fl√©chir, sur leur gouttelette presque impalpable, l'√©difice immense du souvenir."",C2";;;;;;;;;;;;
"2492,""Vous voyez, le r√¥le de l'√©cole a chang√©."",A2";;;;;;;;;;;;
"2493,""L'ann√©e derni√®re, je suis all√© au bord de la Loire pour les vacances."",A2";;;;;;;;;;;;
2494,Elle est grande !,A1;;;;;;;;;;;;
"2495,""Il y en a qui disent que c'est trop, mais pas moi."",B1";;;;;;;;;;;;
"2496,""Les s√©nateurs √©lus au scrutin majoritaire, dont le si√®ge devient vacant pour cause de d√©c√®s, d'acceptation des fonctions de membre du Conseil constitutionnel ou de D√©fenseur des droits ou de prolongation au-del√† du d√©lai de six mois d'une mission temporaire confi√©e par le Gouvernement sont remplac√©s par les personnes √©lues en m√™me temps qu'eux √† cet effet."",C2";;;;;;;;;;;;
"2497,""La naissance des Etats-nations, dont l'unit√© territoriale √©tait √©troitement li√©e √† leur homog√©n√©it√© linguistique, a √©galement jou√© un r√¥le d√©cisif dans la consolidation des langues adopt√©es comme nationales, et la marginalisation des autres."",C1";;;;;;;;;;;;
"2498,""D'apr√®s Marx, les Hommes qui font du travail une contrainte sont ceux qui produisent les objets du d√©sir des Hommes"",C2";;;;;;;;;;;;
"2499,""Je sais qu'elle est souvent seule √† la maison, et que le soir il rentre tr√®s tard."",A2";;;;;;;;;;;;
"2500,""C'est pratique, je veux dire, le moment de convalescence, vous portez un masque, donc de toute fa√ßon en r√®gle g√©n√©rale √ßa ne se voit pas"",B1";;;;;;;;;;;;
2501,Le r√©alisateur m'a expliqu√© qu'il avait longtemps cherch√© l'acteur id√©al.,B1;;;;;;;;;;;;
"2502,""Car sans incertitude nous serions cantonn√©s √† une vie morne, dont la fresque ne serait teinte que de d√©grad√©s de gris, en absence compl√®te de couleurs"",C2";;;;;;;;;;;;
"2503,""En 2003, les Fran√ßais ont ainsi flamb√© 30 milliards d'euros, pour le plus grand profit de l'industrie du secteur et de l'√âtat croupier, qui pr√©l√®ve sa d√Æme."",C2";;;;;;;;;;;;
"2504,""Inversement, les r√©gions temp√©r√©es lointaines n'int√©ressent que m√©diocrement les colonisateurs jusqu'√† l'explosion d√©mographique du Vieux Continent au XIXe si√®cle, moment o√π les pays neufs deviennent des polongements europ√©ens."",C2";;;;;;;;;;;;
"2505,""Ces enfants s'√©taient procur√© quelques petites clefs, et quand la nuit √©tait bien noire, ils essayaient d'ouvrir les cadenas de ces cha√Ænes qui attachent les bateaux √† quelque grosse pierre ou √† quelque arbre voisin du rivage."",C1";;;;;;;;;;;;
"2506,""Nous continuons de parler anglais √† la maison, car mes parents ne veulent pas que je perde ma langue natale"",A2";;;;;;;;;;;;
"2507,""Des paysans et des seigneurs, le plaid sur l'√©paule, chantaient tous ensemble une chanson de chasse "; puis il survint un capitaine qui invoquait l'ange du mal en levant au ciel ses deux bras ; un autre parut ;" ils s'en all√®rent, et les chasseurs reprirent."",C2";;;;;;;;;
2508,L'ensemble comporte √©galement un nombre de pi√®ces r√©duit.,C1;;;;;;;;;;;;
2509,C'est aussi un test pour les couples nouvellement form√©s ou qui n'avaient jamais exp√©riment√© la vie √† deux.,B1;;;;;;;;;;;;
2510,Je lui ai demand√© ce que nous devions faire.,A2;;;;;;;;;;;;
2511,Nous allons au restaurant.,A1;;;;;;;;;;;;
"2512,""Si vous ne mangez que des l√©gumes, ce restaurant n'est pas pour vous !"",B1";;;;;;;;;;;;
2513,Vous √™tes fran√ßaise.,A1;;;;;;;;;;;;
"2514,""Il se vit p√©n√©trant jusqu'au coeur de la grande for√™t, et d√©couvrant une femme qui dormait parmi les branches, couch√©e sur un lit de mousse."",B2";;;;;;;;;;;;
2515,J'ai commenc√© ma journ√©e en jouant du piano.,A2;;;;;;;;;;;;
"2516,""Si vous voulez venir avec moi, je vous montrerai votre table."",A2";;;;;;;;;;;;
"2517,""Il existe des outils pour le rep√©rer, pr√©cisent les promoteurs de la m√©thode."",B2";;;;;;;;;;;;
"2518,""Le centre Anatole France est situ√© dans le centre-ville, √† quelques pas de la mairie."",B1";;;;;;;;;;;;
"2519,""Il est int√©ressant de noter que jusqu'en 1995, le Festival de Deauville n'√©tait pas comp√©titif"",A2";;;;;;;;;;;;
2520,je r√©unis tous ceux qui j'aime bien pour f√™ter l'arriv√©e de l'√©t√©.,A1;;;;;;;;;;;;
2521,L'h√¥tel avait une belle piscine dont je n'ai pas eu le temps de profiter.,B1;;;;;;;;;;;;
"2522,""Une personne d√©sappoint√©e est une personne qui n'a pas obtenu ce qu'elle attendait, ce qu'elle esp√©rait."",A2";;;;;;;;;;;;
"2523,""Certains, juch√©s sur le toit ou l'aile, refusaient de descendre."",C1";;;;;;;;;;;;
"2524,""Mais cette ann√©e, nous ne savons pas si nous pourrons y aller."",B1";;;;;;;;;;;;
"2525,""Le verbe d'Adnane √©tait enti√®rement vaccin√© contre les mots omnipr√©sents de la langue de bois de l'√©poque, comme s'il avait des oreilles-passoires filtrant les mots des m√©dias et des haut-parleurs plant√©s sur chaque quartier."",C2";;;;;;;;;;;;
2526,Il porte aussi des lunettes rouges,A1;;;;;;;;;;;;
2527,√ßa me fait plaisir de manger de bonnes choses.,A2;;;;;;;;;;;;
2528,Chaque hiver constitue une nouvelle menace.,B2;;;;;;;;;;;;
"2529,""Il est agr√©able de se promener pour observer les papillons, les abeilles et √©couter le chant des oiseaux."",A1";;;;;;;;;;;;
"2530,""Un souffle de vent les dispersait, la pierre s'√©tait de nouveau assombrie, mais, comme apprivois√©s, ils revenaient ";" elle recommen√ßait imperceptiblement √† blanchir et par un de ces crescendos continus comme ceux qui, en musique, √† la fin d'une ouverture, m√®nent une seule note jusqu'au fortissimo supr√™me en la faisant passer rapidement par tous les degr√©s interm√©diaires, je la voyais atteindre √† cet or inalt√©rable et fixe des beaux jours, sur lequel l'ombre d√©coup√©e de l'appui ouvrag√© de la balustrade se d√©tachait en noir comme une v√©g√©tation capricieuse, avec une t√©nuit√© dans la d√©lin√©ation des moindres d√©tails qui semblait trahir une conscience appliqu√©e, une satisfaction d'artiste, et avec un tel relief, un tel velours dans le repos de ses masses sombres et heureuses qu'en v√©rit√© ces reflets larges et feuillus qui reposaient sur ce lac de soleil semblaient savoir qu'ils √©taient des gages de calme et de bonheur."",C2";;;;;;;;;;;
"2531,""Des r√©seaux nationaux, puis internationaux, se sont cr√©√©s pour fournir des informations √† leurs membres, pr√©parer des campagnes de sensibilisation, voire faire du lobbying."",C1";;;;;;;;;;;;
"2532,""On e√ªt dit qu'en faisant remarquer leurs ridicules, je trahissais une confidence qu'ils m'avaient faite ";" on e√ªt dit qu'en se montrant √† mes yeux tels qu'ils √©taient, ils avaient obtenu de ma part la promesse du silence : je n'avais point la conscience d'avoir accept√© ce trait√© trop on√©reux."",C2";;;;;;;;;;;
2533,Vous ne risquerez pas de vous ennuyer dans un lieu aussi anim√©.,A2;;;;;;;;;;;;
"2534,""Nous avons l'habitude d'acheter quinze pommes, ce sont elles qui les comptent et les mettent dans notre panier."",A2";;;;;;;;;;;;
"2535,""Les motocyclettes peuvent se classer en diff√©rents types, chaque type ayant des caract√©ristiques diff√©rentes telles que la maniabilit√©, le poids ou la position de pilotage."",C1";;;;;;;;;;;;
"2536,""Cette fois, c'est vous qui caricaturez !"",A2";;;;;;;;;;;;
"2537,""Sans son manteau et ses gants, ils seraient morts de froid."",B2";;;;;;;;;;;;
"2538,""D'apr√®s des ordres venus de Vienne, le g√©n√©ral autrichien re√ßut le marquis del Dongo avec une consid√©ration voisine du respect ";" on se h√¢ta de lui offrir une des premi√®res places dans le gouvernement, et il l'accepta comme le paiement d'une dette."",C1";;;;;;;;;;;
"2539,""Selon les pronostics, de 50 √† 90 % des langues parl√©es aujourd'hui mourront au cours de ce si√®cle."",C1";;;;;;;;;;;;
2540,Je vais √† l'√©cole pendant la journ√©e. Mon p√®re s'appelle Alain.,A1;;;;;;;;;;;;
"2541,""Car √† la tentation minutieusement encourag√©e par les industriels du secteur, s'ajoute la fascination m√™me du jeu, dont la puissance de s√©duction peut parfois faire perdre pied."",C2";;;;;;;;;;;;
2542,Je t'embrasse.,A2;;;;;;;;;;;;
2543,Il faisait toujours tr√®s beau et surtout tr√®s chaud,A2;;;;;;;;;;;;
"2544,""D'autres supportent moins bien cette promiscuit√© et """"commencent d√©j√† √† voir les murs se refermer sur eux"""", note le quotidien am√©ricain, qui a recueilli le t√©moignage d'Hugo, 26 ans."",C1";;;;;;;;;;;;
2545,Il prend le bus tous les soirs.,A2;;;;;;;;;;;;
2546,Apr√®s cette d√©claration h√©ro√Øque la comtesse ne voulut plus des chevaux ni de la loge du comte N. Mais depuis quinze ans elle √©tait accoutum√©e √† la vie la plus √©l√©gante : elle eut √† r√©soudre ce probl√®me difficile ou pour mieux dire impossible : vivre √† Milan avec une pension de quinze cents francs.,C1;;;;;;;;;;;;
2547,Il y a eu beaucoup de spectateurs et tout le monde a bien aim√© la F√™te.,A2;;;;;;;;;;;;
"2548,""Pour avoir plus d'informations, tu peux venir voir le m√©decin de l'√©cole tous les jours au bureau 4B, au 4e √©tage."",A2";;;;;;;;;;;;
"2549,""Il entendait dans toute cette vaste maison une rumeur confuse, ce bruissement des grands restaurants fait du bruit des vaisselles et des argenteries heurt√©es, du bruit des pas rapides des gar√ßons adouci par le tapis des corridors, du bruit des portes un moment ouvertes et qui laissent 147 √©chapper le son des voix de tous ces √©troits salons o√π sont enferm√©s des gens qui d√Ænent."",C2";;;;;;;;;;;;
2550,Devenir ch√™vre,C1;;;;;;;;;;;;
2551,Certaines familles ont pour tradition de d√©poser des biscuits et un verre de lait pr√®s du sapin pour remercier le p√®re no√´l.,B1;;;;;;;;;;;;
2552,ne te fais pas tuer.,B1;;;;;;;;;;;;
"2553,""En 1913, moins de 1 travailleur sur 3, d√©rogations obligent, b√©n√©ficie r√©ellement de ces vingt-quatre heures ch√¥m√©es."",C2";;;;;;;;;;;;
"2554,""Dans la tribu, on n'aime pas les enfants sans p√®re, on dit que ce sont les enfants des mauvais esprits."",B1";;;;;;;;;;;;
"2555,""M√™me si je ne suis pas fanatique de fast-food, je ne vois pas pourquoi je ne mangerais pas de pizza et de hamburgers."",A2";;;;;;;;;;;;
"2556,""Devant la maison, il y a une cour minuscule."",A2";;;;;;;;;;;;
"2557,""Faits divers, faits divers, alors qu'on est au printemps, faits divers alors qu'on est au printemps - """"d'hiver"""""",C1";;;;;;;;;;;;
2558,Un ami m'a √©crit une lettre.,A1;;;;;;;;;;;;
"2559,""Puis, sortant mon mouton de sa poche, il se plongea dans la contemplation de son tr√©sor."",B2";;;;;;;;;;;;
"2560,""√áa vous d√©bagoule des raisons, des accusations, des syllogismes, des calomnies, des paroles √† rendre fou !"",C2";;;;;;;;;;;;
2561,La prolif√©ration de la culture sur br√ªlis a largement d√©grad√© la for√™t ivoirienne alors que le Gabon a plus √† craindre de l'ouverture de son couvert forestier √† l'exploitation industrielle du bois.,B2;;;;;;;;;;;;
"2562,""Une fois qu'il a tout fini, Th√©o peut enfin aller jouer et s'amuser avant de d√Æner avec ses parents."",A2";;;;;;;;;;;;
2563,Elle doit √™tre faite avec de l'eau.,B1;;;;;;;;;;;;
"2564,""Elle rit, alla et vint, se sachant admir√©e, sentant que sa robe plaquait bien aux endroits n√©cessaires."",C1";;;;;;;;;;;;
2565,Il y a une armoire ?,A1;;;;;;;;;;;;
"2566,""Pour dissuader ses lyc√©ens de faire les Beaux-arts, l'√âcole du cirque ou un dipl√¥me d'arts du spectacle, un proviseur avait coutume de leur raconter cette histoire."",C1";;;;;;;;;;;;
"2567,""En Am√©rique du Nord, LeeAnn Walters, une femme au foyer, a √©t√© distingu√©e pour avoir cr√©√© un mouvement citoyen qui a permis de r√©v√©ler la crise de l'eau contamin√©e de Flint dans le Michigan"",B1";;;;;;;;;;;;
"2568,""Le jour de la F√™te des m√®res, la tradition consiste le plus souvent √† offrir un petit cadeau aux mamans, comme en France."",A2";;;;;;;;;;;;
2569,A qui le pacha vient en aide ?,A2;;;;;;;;;;;;
2570,Illusion du laid qui est une opinion changeante! Illusion du vrai jamais immuable!,B2;;;;;;;;;;;;
2571,Elle met son chapeau et elle va √† l'√©picerie de quartier.,A2;;;;;;;;;;;;
"2572,""La lumi√®re tombait si implacable du ciel devenu fixe que l'on aurait voulu se soustraire √† son attention, et l'eau dormante ellem√™me, dont des insectes irritaient perp√©tuellement le sommeil, r√™vant sans doute de quelque Maelstr√¥m imaginaire, augmentait le trouble o√π m'avait jet√© la vue du flotteur de li√®ge en semblant l'entra√Æner √† toute vitesse sur les √©tendues silencieuses du ciel refl√©t√© ";" presque vertical il paraissait pr√™t √† plonger et d√©j√† je me demandais, si, sans tenir compte du d√©sir et de la crainte que j'avais de la conna√Ætre, je n'avais pas le devoir de faire pr√©venir Mlle Swann que le poisson mordait - quand il me fallut rejoindre en courant mon p√®re et mon grand-p√®re qui m'appelaient, √©tonn√©s que je ne les eusse pas suivis dans le petit chemin qui monte vers les champs et o√π ils s'√©taient engag√©s."",C2";;;;;;;;;;;
"2573,""Heureusement, par pure modestie, il n'avait pas parl√© des diamants donn√©s par sa m√®re."",B2";;;;;;;;;;;;
"2574,""Il accepte les diff√©rences, il est tol√©rant."",B1";;;;;;;;;;;;
2575,L'influence du microbiote sur notre comportement a pu √™tre observ√©e.,C1;;;;;;;;;;;;
2576,La formation s'ach√®vera par un contr√¥le pour savoir si le propri√©taire a int√©gr√© les connaissances.,B2;;;;;;;;;;;;
2577,Le robot a r√©ussi √† lancer un forage de derni√®re minute m√™me si on ne sait pas encore s'il a pu ramener un √©chantillon de la surface de la com√®te.,B1;;;;;;;;;;;;
2578,Les enfants chant√®rent les chansons qu'ils eurent apprises de leur professeur,C2;;;;;;;;;;;;
"2579,""En clair, les adolescentes souffrent d'un complexe d'inf√©riorit√© par rapport √† leurs comparses masculins, comme l'a montr√© cette sociologue de l'√©ducation dans un ouvrage de r√©f√©rence, L'Ecole des filles (L'Harmattan)."",C1";;;;;;;;;;;;
"2580,""Quand j'√©coute ma musique, il faut que je l'appr√©cie et c'est pour √ßa que je suis exigeant, je crois"",A2";;;;;;;;;;;;
"2581,""Une exposition de soies, de satins et de velours, y √©panouissait, dans une gamme souple et vibrante, les tons les plus d√©licats des fleurs : au sommet, les velours, d'un noir profond, d'un blanc de lait caill√© "; plus bas, les satins, les roses, les bleus, aux cassures vives, se d√©colorant en p√¢leurs d'une tendresse infinie ; plus bas encore, les soies, toute l'√©charpe de l'arc-en-ciel, des pi√®ces retrouss√©es en coques, pliss√©es comme autour d'une taille qui se cambre, devenues vivantes sous les doigts savants des commis ;" et, entre chaque motif, entre chaque phrase color√©e de l'√©talage, courait un accompagnement discret, un l√©ger cordon bouillonn√© de foulard cr√®me."",C2";;;;;;;;;
"2582,""La soci√©t√© m'importune, la solitude m'accable."",C2";;;;;;;;;;;;
2583,Nous voulons surmonter les obstacles judiciaires et techniques qui nous emp√™chent d'intercepter les conversations t√©l√©phoniques par Skype entre les suspects.,C1;;;;;;;;;;;;
2584,Ma m√®re est allemande et est avocate,A1;;;;;;;;;;;;
"2585,""Edgar, √©tincelant de furie, dominait tous les autres de sa voix plus claire."",C1";;;;;;;;;;;;
"2586,""Il avait toujours accord√©, quelquefois pr√©venu mes demandes √† cet √©gard."",C1";;;;;;;;;;;;
"2587,""C'est g√©nial, j'ai tout vu avant vous !"",A2";;;;;;;;;;;;
"2588,""Heureusement pour lui, les larmes qui embuaient les yeux de Laurence refl√©taient sa joie, tout comme son sourire radieux"",B2";;;;;;;;;;;;
"2589,""Si Dieu le veut Bonjour, Anne!"",A1";;;;;;;;;;;;
2590,C'est un parc o√π les gens viennent se promener en famille et entre amis,B1;;;;;;;;;;;;
"2591,""Dans une grande salle au design √©pur√©, ils sont une cinquantaine d'√©tudiants de 18 √† 34 ans, les yeux riv√©s sur leur √©cran d'ordinateur."",B2";;;;;;;;;;;;
2592,Je suis venu d√®s que j'ai appris la nouvelle.,A2;;;;;;;;;;;;
"2593,""""""Comment voulez-vous demander une analyse grammaticale ou parler du pronom relatif √† un enfant qui n'emploie que des propositions juxtapos√©es ?"""""",C2";;;;;;;;;;;;
"2594,""Quand on est ado, on se pose des tas de questions."",A2";;;;;;;;;;;;
2595,Il a ouvert un g√Æte de randonneurs en Haute-Savoie.,C1;;;;;;;;;;;;
"2596,""A 50-55 ans d√©bute la deuxi√®me vie adulte, √† laquelle il faudra donner un nom, un statut, un contenu."",C1";;;;;;;;;;;;
"2597,""Demain, nous nous l√®verons t√¥t et nous nous prom√®nerons dans la les bois situ√©s aux alentours du manoir."",B1";;;;;;;;;;;;
"2598,""Il faudrait d'abord lui faire visiter un peu les chambres, la salle de restaurant, et le reste."",B1";;;;;;;;;;;;
2599,J'esp√®re que cette nouvelle histoire vous a plu.,A2;;;;;;;;;;;;
"2600,""D'apr√®s des t√©moignages de chefs d'entreprise recueillis dans le Guide France Info Le salari√© handicap√© dans l'entreprise, ce dernier est un salari√© comme les autres, avec en plus, la volont√© de s'en sortir ."",B1";;;;;;;;;;;;
"2601,""Dot√© de 410 millions de dollars, il servira √† financer l'adaptation des pays du Sud et le d√©veloppement d'√©nergies propres."",C1";;;;;;;;;;;;
2602,J'ai faim,A1;;;;;;;;;;;;
"2603,""On m'a souvent demand√© comment j'avais fait pour comprendre Coluche, et ce que je gardais comme souvenir de ce tournage."",B1";;;;;;;;;;;;
"2604,""On reconna√Æt alors qu'il recouvre des analyses, des acteurs, des histoires et des pratiques multiples aux finalit√©s compl√©mentaires ou diff√©rentes, voire antagonistes."",C1";;;;;;;;;;;;
"2605,""Je me donnai bient√¥t, par cette conduite, une grande r√©putation de l√©g√®ret√©, de persiflage, de m√©chancet√©."",C2";;;;;;;;;;;;
"2606,""Ma voiture est tr√®s √©cologique, elle roule √† l'√©nergie solaire"",B1";;;;;;;;;;;;
"2607,""Stop : tout d'abord, figurez-vous que les vrais nouveaux p√®res n'ont aucune envie d'√™tre appel√©s comme cela."",B2";;;;;;;;;;;;
"2608,""Puis je me bagarrais avec Daffy, mon canard en peluche, je m√¢chouillais mon os qui couine ou je chantais √† l'unisson avec la radio de la voisine"",C1";;;;;;;;;;;;
"2609,""Le nombre insuffisant de professeurs form√©s est √©galement un frein pour beaucoup d'adversaires de cette mesure, qui la jugent inapplicable."",C2";;;;;;;;;;;;
"2610,""Comme toujours, l'histoire peut apporter des enseignements int√©ressants."",B2";;;;;;;;;;;;
2611,Tr√®s bien !,A1;;;;;;;;;;;;
2612,Va-t'en !,A1;;;;;;;;;;;;
