id,sentence,difficulty;;;;;;;;;;;;
3666,Le rythme d'extinction des langues a ainsi atteint des proportions sans pr√©c√©dent dans l'histoire : 10 par an √† l'√©chelle mondiale.,C1;;;;;;;;;;;;
"3667,""Plusieurs √©tudes ont d√©montr√© que l'√©cobilan des modules photovolta√Øques (√©nergie grise. √âmission du gaz √† effet de serre.) est relativement positif, compar√© √† d'autres fili√®res de production d'√©nergie."",C2";;;;;;;;;;;;
3668,Ce d√©passement r√©troactif de la Renaissance europ√©enne a pour cons√©quence l'abandon du mod√®le √©volutionniste lin√©aire tel que l'Europe des Lumi√®res puis le positivisme du XIXe si√®cle l'avaient formalis√©.,C2;;;;;;;;;;;;
"3669,""Clara a bu de l'eau, son fr√®re a bu un verre de vin"",A1";;;;;;;;;;;;
"3670,""Il y a une ru√©e vers : """"devenons un peu plus ind√©pendants, moins d√©pendants des magasins, de l'importation, des grandes surfaces"""", donc une esp√®ce de retour au savoir-faire artisan, un peu de nos anc√™tres, de nos parents, de nos grands-parents."",B2";;;;;;;;;;;;
3671,Il s'agit d'un projet pour la paix de notre temps.,B1;;;;;;;;;;;;
"3672,""Tout comme les comportements des animaux sont d√©termin√©s par l'instinct, leur environnement ou des d√©terminations biologiques, les actes et les pens√©es des hommes le sont eux-m√™mes par de multiples facteurs √† la fois internes et externes dont on ignore le plus souvent l'existence et la puissance : facteurs d'origine physiologiques, psychologiques, sociales, etc"",C2";;;;;;;;;;;;
"3673,""Voil√† le chemin √† suivre, finissons-en avec ce d√©calage inacceptable entre la cuisine d'en haut (consomm√©e par une minorit√©) et la cuisine d'en bas, celle de la majorit√© silencieuse, d√©bordante et insipide."",C1";;;;;;;;;;;;
"3674,""S'ils vont au cin√©ma pour l'avant-premi√®re, ils verront le dernier film de ce r√©alisateur de notori√©t√© internationale."",B2";;;;;;;;;;;;
"3675,""Vous pouvez expliquer encore une fois, s'il vous pla√Æt ?"",A1";;;;;;;;;;;;
3676,Il y a eu trois exp√©ditions.,B1;;;;;;;;;;;;
3677,Les Inuits attendent seulement d'elle une d√©claration politique.,C1;;;;;;;;;;;;
"3678,""""""On pensait autrefois que si les r√©gimes alimentaires √©taient suffisamment √©nerg√©tiques, les micronutriments suivraient"""", explique ainsi Barbara Burlingame, fonctionnaire principale de la FAO."",C1";;;;;;;;;;;;
"3679,""Consid√©r√© d√®s sa naissance comme un fils √† part enti√®re par son p√®re, il ne fut cependant jamais l√©gitim√©."",C2";;;;;;;;;;;;
"3680,""Nous sommes en 1915, √† Vitebsk, la ville natale de Marc Chagall."",B2";;;;;;;;;;;;
"3681,""Un pr√©sage connu rapporte qu'un milan venu du ciel aurait fait un vol stationnaire au-dessus de son berceau, la queue de l'oiseau le touchant au visage."",C2";;;;;;;;;;;;
"3682,""Cet h√©ritage s'est d'ailleurs vite r√©v√©l√© h√©t√©rog√®ne : les pays pauvres d'Asie orientale, les plus √©loign√©s des anciennes m√©tropoles, """"√©mergent"""" √† des degr√©s divers dans l'√©conomie mondiale d√®s les ann√©es 1970-1980."",C2";;;;;;;;;;;;
"3683,""Trop se sp√©cialiser dans un environnement qui change sans cesse, c'est comme rouler vite avec des oeill√®res."",C2";;;;;;;;;;;;
"3684,""Merci Madame, biologiste, vous avez fond√© le site, l'association Inversons la classe."",C1";;;;;;;;;;;;
"3685,""Je crois qu'en cinquante ans d'amiti√© on ne s'est pas disput√©es une fois, on a eu des petits mots de temps en temps mais jamais on s'est fait la t√™te, jamais on n'est rest√©es sans se parler, jamais, jamais, jamais."",A1";;;;;;;;;;;;
3686,Plusieurs milliers de classes ont particip√© √† ce projet.,C2;;;;;;;;;;;;
"3687,""Bref, premi√®re le√ßon, le qu√©b√©cois n'est pas un fran√ßais d√©form√© mais plut√¥t un fran√ßais historique, proche de celui qui √©tait parl√© en France avant le 17e si√®cle"",C1";;;;;;;;;;;;
"3688,""L'extr√©mit√© sup√©rieure de la corde est attach√©e √† une planchette doubl√©e de li√®ge, et une branche de coudrier tr√®s flexible, fich√©e sur cette planchette, soutient une petite sonnette qui tinte lorsque le poisson, pris √† la ligne, donne des secousses √† la corde."",C1";;;;;;;;;;;;
"3689,""Et c'√©tait pas forc√©ment une image qui me plaisait, comme j'avais l'occasion de pouvoir les changer, j'ai voulu le faire"",B1";;;;;;;;;;;;
"3690,""Une semaine au calme, √ßa procure un vrai plaisir."",B1";;;;;;;;;;;;
3691,Il faut aussi poser des questions sur le travail et les horaires de l'entreprise,A2;;;;;;;;;;;;
3692,Je recherche une personne pour garder mes enfants de 1 et 7 ans.,A1;;;;;;;;;;;;
3693,Je vais prendre ma douche dans ma salle-de-bain.,A1;;;;;;;;;;;;
3694,√ätes-vous pr√™ts √† d√©couvrir cette histoire de No√´l ?,A2;;;;;;;;;;;;
"3695,""Il passa contre nous, ne s'interrompit pas de parler √† sa voisine, et nous fit du coin de son oeil bleu un petit signe en quelque sorte int√©rieur aux paupi√®res et qui, n'int√©ressant pas les muscles de son visage, put passer parfaitement inaper√ßu de son interlocutrice "; mais, cherchant √† compenser par l'intensit√© du sentiment le champ un peu √©troit o√π il en circonscrivait l'expression, dans ce coin d'azur qui nous √©tait affect√© il fit p√©tiller tout l'entrain de la bonne gr√¢ce qui d√©passa l'enjouement, frisa la malice ; il subtilisa les finesses de l'amabilit√© jusqu'aux clignements de la connivence, aux demi-mots, aux sousentendus, aux myst√®res de la complicit√© ;" et finalement exalta les assurances d'amiti√© jusqu'aux protestations de tendresse, jusqu'√† la d√©claration d'amour, illuminant alors pour nous seuls, d'une langueur secr√®te et invisible √† la ch√¢telaine, une prunelle √©namour√©e dans un visage de glace."",C2";;;;;;;;;
3696,Il ne reste donc plus qu'√† attendre.,A2;;;;;;;;;;;;
3697,L'objectif est de r√©suire les risques sanitaires et de diminuer les nuisances sur l'espace public,B2;;;;;;;;;;;;
3698,La plateforme mettra √† disposition l'ensemble de son catalogue musical et dit vouloir collaborer avec des acteurs locaux pour pouvoir √©largir son offre de musique issue du march√© concern√©.,B2;;;;;;;;;;;;
"3699,""Nicolas va se marier, pour la deuxi√®me fois."",A1";;;;;;;;;;;;
"3700,""√âgalement noble de visage et de corps, dans l'action comme au repos, plein de gr√¢ce et de puissance mesur√©e, il gardait au milieu de l'effort le souci inconscient des pures attitudes, et les moindres de ses gestes paraissaient des bienfaits."",B2";;;;;;;;;;;;
"3701,""Le beau monsieur, qui √©tait magicien, le for√ßa alors √† le conduire √† la montagne, et √† ouvrir le rocher en le touchant avec l'herbe merveilleuse."",B1";;;;;;;;;;;;
3702,Son grand chapeau √† l'espagnole tomba dans un geste qu'il fit ; et aussit√¥t les instruments et les chanteurs entonn√®rent le sextuor.,C2;;;;;;;;;;;
"3703,""Du fond de la t√©n√®bre verte, toute cribl√©e de gouttes de lumi√®re, une petite forme humaine, pelotonn√©e dans son √©lan, d√©boula comme un li√®vre."",C2";;;;;;;;;;;;
3704,Forestier riait beaucoup de l'aventure ; les deux femmes d√©claraient que le bavard indiscret n'√©tait qu'un goujat et qu'un l√¢che.,C2;;;;;;;;;;;
3705,Il travaille en ville.,A1;;;;;;;;;;;;
"3706,""En juillet, ma famille et moi irons dans le Sud de la France."",B1";;;;;;;;;;;;
3707,Je vais revenir avec les enfants la semaine prochaine.,A1;;;;;;;;;;;;
"3708,""La recomposition conjugale apr√®s 50 ans est en forte progression, pr√©cise Vincent Caradec, professeur de sociologie √† l'universit√© de Lille III (Vieillir apr√®s la retraite, PUF)."",C1";;;;;;;;;;;;
"3709,""Ils sont trop mignons Mon pr√©f√©r√© est noir et blanc, et il s'appelle"",A2";;;;;;;;;;;;
3710,Cette situation est d'autant plus pr√©occupante que la part de cr√©ation de valeur des entreprises issue de la valorisation de ces actifs intellectuels est jug√©e par certains comme d√©passant actuellement celle g√©n√©r√©e par les actifs mat√©riels,C2;;;;;;;;;;;;
"3711,""√Ä gauche, c'est ma salle de bain, avec vue sur mon jardin."",A2";;;;;;;;;;;;
"3712,""Et apr√®s, on peut prendre un bain dans la piscine, l'eau est bonne !"",A1";;;;;;;;;;;;
"3713,""""""Or, une forte exposition m√©diatique d'un √©v√©nement sportif, qui plus est lorsqu'elle est associ√©e √† de bonnes performances de la part des sportifs (en particulier fran√ßais), est susceptible de g√©n√©rer un engouement pour la pratique sportive"""", explique l'Insee."",C1";;;;;;;;;;;;
"3714,""Par-del√† ces collines, dont le fa√Æte offre des ermitages qu'on voudrait tous habiter, l'oeil √©tonn√© aper√ßoit les pics des Alpes, toujours couverts de neige, et leur aust√©rit√© s√©v√®re lui rappelle des malheurs de la vie ce qu'il en faut pour accro√Ætre la volupt√© pr√©sente."",C1";;;;;;;;;;;;
"3715,""En gros, je n'ai rien contre les uniformes."",B1";;;;;;;;;;;;
3716,Ma maison est grande,A1;;;;;;;;;;;;
3717,Je vous coupe les cheveux.,A1;;;;;;;;;;;;
3718,L'homme avait l'intention de sortir sa femme du trou.,B1;;;;;;;;;;;;
3719,Un technicien fait le n√©cessaire et vous rappelle dans une heure environ.,A1;;;;;;;;;;;;
3720,Elle avait besoin de passer un instant seule.,A2;;;;;;;;;;;;
"3721,""Or une telle vie, guid√©e par des d√©sirs multiples, polymorphes et surtout infinis, m√®ne n√©cessairement au tourment et au malheur"",C2";;;;;;;;;;;;
"3722,""En 1902, pour √©viter l'extinction, le parc national de Yellowstone (Wyoming) prend en charge vingt et un bisons : ils deviennent la premi√®re esp√®ce animale prot√©g√©e."",C1";;;;;;;;;;;;
"3723,""Le prince Charles, 56 ans, et sa compagne, Camilla Parker-Bowles, 57 ans, ne s'appr√™tent-ils pas √† convoler, enfin?"",C1";;;;;;;;;;;;
3724,Je ne pourrai pas venir demain.,A2;;;;;;;;;;;;
3725,Avoir un chien est un vrai bonheur mais encore faut-il s'en occuper correctement.,B1;;;;;;;;;;;;
3726,Cerveau et seau de plage jouent-ils les vases communicants ?,C2;;;;;;;;;;;;
3727,Que restera-t-il aÃÄ la rentreÃÅe des acquis de l'anneÃÅe scolaire ?,C2;;;;;;;;;;;;
3728,Envoie-moi un mot pour confirmer votre pr√©sence.,A1;;;;;;;;;;;;
3729,Le cabotin diplomate avait m√™me soin de faire toujours glisser dans les r√©clames une phrase po√©tique sur la fascination de sa personne et la sensibilit√© de son √¢me.,C2;;;;;;;;;;;;
3730,Nous nageons dans la piscine.,A1;;;;;;;;;;;;
"3731,""La couverture du bouquin √©tait couleur bleu turquoise, je l'ai ador√©e d√®s que je l'ai vue."",B1";;;;;;;;;;;;
"3732,""De Buren exprime ces diff√©rents points de vue sur la ressource √† travers une triple d√©finition du concept : la ressource institutionnelle, telle qu'elle per√ßut au travers des r√®gles qui encadrent ses usages, la ressource physique per√ßue au travers des fonctions qu'elle remplit et finalement la ressource sociale, lorsqu'elle est envisag√©e au travers des relations, qui se nouent entre ses usages."",C2";;;;;;;;;;;;
3733,Ce commandant mena plusieurs batailles √©piques gr√¢ce √† sa bravour et ses tactiques militaires ing√©nieuses.,C1;;;;;;;;;;;;
"3734,""Selon un sondage publi√© en mai dernier par BVA (soci√©t√© fran√ßaise de sondages) et le Syntec Num√©rique (f√©d√©ration professionnelle du secteur informatique) favorable √† la mesure, 87 % des Fran√ßais seraient m√™me d'accord pour que la programmation informatique soient enseign√©e √† l'√©cole."",C1";;;;;;;;;;;;
3735,Je suis devenue tr√®s copine avec la fille de 14 ans.,A2;;;;;;;;;;;;
"3736,""Le deuxi√®me profil repr√©sente les cantons qui ont des instruments de contingentement spatial √† l'apparence similaires √† ceux du premier groupe, mais qui sont utilis√©s avec une pr√©cision moindre et ouvrant plus facilement la porte √† des exceptions et √† des modifications des limites des zones constructibles."",C2";;;;;;;;;;;;
"3737,""De peur de para√Ætre ridicule, Emma voulut, avant d'entrer, faire un tour de promenade sur le port, et Bovary, par prudence, garda les billets √† sa main, dans la poche de son pantalon, qu'il appuyait contre son ventre."",C1";;;;;;;;;;;;
3738,Les appr√©ciations sur le bulletin de notes sont aussi importantes que les moyennes elles-m√™mes.,B2;;;;;;;;;;;;
"3739,""D'abord, nous voulions dormir √† l'h√¥tel mais finalement Martine, mon amie d'enfance, nous a propos√© d'aller chez elle alors nous avons accept√©."",B1";;;;;;;;;;;;
"3740,""A l'arri√®re, ils ont un jardin magnifique."",A2";;;;;;;;;;;;
"3741,""√Ä mi-parcours, il doit souvent faire demi-tour."",B2";;;;;;;;;;;;
3742,Vous mange√¢tes des escargots et des langoustines servis dans un plat garnit de glace pill√©e afin de conserver le met prestigieux au frais.,C1;;;;;;;;;;;;
3743,La r√©ponse est oui.,A1;;;;;;;;;;;;
3744,Chaque organe doit trouver sa place en fonction de crit√®res diff√©rents comme le centre de gravit√©.,C1;;;;;;;;;;;;
"3745,""Le centre commercial est l'endroit ideÃÅal pour passer un bon moment avec sa famille, ses amis ou ses colleÃÄgues de travail"",A2";;;;;;;;;;;;
"3746,""Elle sourit involontairement de vanit√©, en voyant la foule qui se pr√©cipitait √† droite par l'autre corridor, tandis qu'elle montait l'escalier des premi√®res."",C2";;;;;;;;;;;;
3747,Comment est-ce que je me sens ? J'ai peur d'une nouvelle √©ruption,A2;;;;;;;;;;;;
"3748,""C'est alors qu'on le voyait, se promenant sur le Prater, porter dans un poing ostensiblement serr√© l'exquis mouchoir de lin jaune et noir qui √©voquait √† grands cris l'ordonnance de 1468 promulgu√©e par un certain Pietro Barbo et exigeant que, la corde au cou, la race de Guido cour√ªt sur le Corso pour l'amusement de la populace chr√©tienne, cependant que les dames de noble naissance, assises sur des colonnes vert√©brales trop raffin√©es pour se d√©tendre, se levaient de leurs si√®ges et, en compagnie des cardinaux √† robe rouge et des monsignori, applaudissaient avec l'abandon froid mais hyst√©rique d'un peuple qui est tout ensemble injuste et heureux - le pape lui-m√™me √©tant pr√©cipit√© de sa prise sur le ciel par le rire d'un homme qui renonce √† ses anges pour r√©cup√©rer la b√™te."",C2";;;;;;;;;;;;
3749,Communiquer et penser dans tant de langages impose √† l'individu contemporain d'entrer dans des syst√®mes et des r√©seaux qu'il doit comprendre et hi√©rarchiser.,C2;;;;;;;;;;;;
3750,Les membres sont au nombre de quatre,B1;;;;;;;;;;;;
3751,Quel personnage meurt √† la fin de cette histoire ?,B1;;;;;;;;;;;;
3752,Ils ont peint le mur sale de la cuisine.,A2;;;;;;;;;;;;
3753,Le bras est reli√© au tronc par l'√©paule et √† l'avant-bras par le coude,B1;;;;;;;;;;;;
3754,On peut faire une classe invers√©e en restant dans le transmissif.,B1;;;;;;;;;;;;
"3755,""Comme Jean-Christophe Deledicq, un informaticien fondateur de la librairie des maths, pour qui """"il y a tellement de mani√®res d'aimer les math√©matiques [qu'il propose] de nombreux produits plus ou moins litt√©raires, plus ou moins ludiques"""""",C2";;;;;;;;;;;;
"3756,""Quand vous disposez de tous vos fichiers num√©ris√©s, vous pouvez effectuer la formalit√© en ligne en remplissant le formulaire interactif que vous validerez en fin de saisie."",B2";;;;;;;;;;;;
3757,Qui est absent ?,A1;;;;;;;;;;;;
"3758,""Comme le chr√©tien qui veut se d√©livrer du corps, par l√† m√™me pense sans cesse √† son corps, de m√™me ces philosophies, sans cesse en lutte contre l'empirique, sont encha√Æn√©es √† l'empirique."",C2";;;;;;;;;;;;
"3759,""Il apprend ensuite tout ce qui concerne """"la recherche"""", c'est-√†-dire savoir trouver et identifier les passages pi√©tons, les pistes cyclables et les rues, s'arr√™ter devant les portes ou les escaliers, savoir √©viter les difficult√©s, monter dans les transports, etc."",B1";;;;;;;;;;;;
"3760,""Entre-temps, cette inflation a dop√© les interactions et donn√© une place nouvelle √† l'Europe vis-√†-vis des autres ensembles sociaux de l'Ancien Monde."",C1";;;;;;;;;;;;
3761,Tu es am√©ricain et elle est anglaise.,A1;;;;;;;;;;;;
3762,j'esp√®re vous avoir pr√®s de moi pour une jolie f√™te.,A1;;;;;;;;;;;;
"3763,""Quand tu eus appel√© √† l'aide, ils vinrent nous porter secours"",C2";;;;;;;;;;;;
"3764,""A cette vie d√©sordonn√©e, Platon oppose une vie guid√©e par la raison, incarn√©e par la sagesse socratique"",C2";;;;;;;;;;;;
3765,Elle fit semblant de ne pas l'entendre et continua d'avancer.,B1;;;;;;;;;;;;
"3766,""Au moment de payer, notre petit gar√ßon est toujours volontaire."",A2";;;;;;;;;;;;
3767,Un r√™ve d'enfant r√©alis√©.,A1;;;;;;;;;;;;
"3768,""La plate-forme fran√ßaise du commerce √©quitable (PFCE), r√©seau des treize principales associations et entreprises fran√ßaises, a √©labor√© sa propre charte."",C1";;;;;;;;;;;;
3769,Rien ne va plus: les primaires du parti socialiste tournent en eau de boudin.,B2;;;;;;;;;;;;
3770,Dites-moi o√π me cacher.,A2;;;;;;;;;;;;
3771,Il y a beaucoup de pi√®ces,A2;;;;;;;;;;;;
3772,Nous sommes en vacances chez des amis.,A1;;;;;;;;;;;;
"3773,""Le chancelier autrichien a annonc√© ne plus vouloir d√©pendre de l'Union europ√©enne pour la production de vaccins et que, avec la Premi√®re ministre danoise, il allait engager des discussions avec Isra√´l."",B2";;;;;;;;;;;;
3774,Les changements g√©ographiques apparaissent alors autant comme des causes que des cons√©quences des dynamiques historiques.,C1;;;;;;;;;;;;
"3775,""Il a pr√©cis√© qu'il n'avait pas pr√©vu de le faire, et il a ajout√© qu'il le regrettait."",B1";;;;;;;;;;;;
"3776,""√âvaluant l'int√©r√™t croissant port√© √† son r√©cit, l'homme de Barb√®s sirotait une tasse de th√©, √©talait son sourire √©dent√© et continuait, d'une voix encore plus vive."",B2";;;;;;;;;;;;
"3777,""En allant √† la campagne, nous aurions cueilli des petits fruits."",B2";;;;;;;;;;;;
3778,Nous pass√¢mes quelque temps √† Arcachon et je fus √† l'√©cole communale: les principes d√©mocratiques de mon grand-p√®re l'exigeaient.,C1;;;;;;;;;;;;
3779,C'est un fait inqui√©tant qu'on constate dans toutes les capitales europ√©ennes : les touristes s√©journent de plus en plus dans des appartements lou√©s sur des sites internet.,B1;;;;;;;;;;;;
"3780,""En analysant les donn√©es recueillies lors des √©preuves d'√©valuation dans le primaire et le secondaire, on constate qu'il n'y a aujourd'hui pas de diff√©rences de performances entre filles et gar√ßons."",B2";;;;;;;;;;;;
"3781,""C'est pourquoi, il d√©cida de remplacer les habi-tuelles portes automatiques par des portiers en superbe livr√©e, ce qui donna un caract√®re tr√®s luxueux √† cet a√©roport."",C2";;;;;;;;;;;;
3782,Il a su se d√©fendre et mentir lorsqu'on lui posait des questions embarassantes.,B1;;;;;;;;;;;;
3783,Nommez-les dans l'ordre.,A1;;;;;;;;;;;;
3784,L'oiseau s'approcha de lui √† tout petits pas.,A2;;;;;;;;;;;;
"3785,""Loin d'une soci√©t√© oisive, il faut continuer √† innover et aider les populations qui risquent de voir leur travail dispara√Ætre en les formant √† d'autres talents."",C2";;;;;;;;;;;;
3786,Toutes ces f√™tes ont le m√™me but : remercier les mamans pour ce qu'elles font toute l'ann√©e !,A2;;;;;;;;;;;;
"3787,""Le dimanche, nous aimons nous promener en famille dans la for√™t proche de notre maison et faire des jeux"",A1";;;;;;;;;;;;
"3788,""Si quelque petit champ de cinquante pas de large vient interrompre de temps √† autre les bouquets de ch√¢taigniers et de cerisiers sauvages, l'oeil satisfait y voit cro√Ætre des plantes plus vigoureuses et plus heureuses l√† qu'ailleurs."",C1";;;;;;;;;;;;
"3789,""Une heure plus tard, il donne √† la tribu une ch√®vre sauvage qu'il vient de tuer."",A2";;;;;;;;;;;;
"3790,""Si vous pouviez rencontrez un artiste, qui est-ce que vous aimeriez rencontrer?"",B1";;;;;;;;;;;;
"3791,""Sur le fond, il enclenche une politique progressiste"",C1";;;;;;;;;;;;
3792,Une maitresse au milieu du bruit des enfants : On va les compter,A2;;;;;;;;;;;;
3793,Elle a 38 ans,A1;;;;;;;;;;;;
"3794,""Quand les couches-culottes usag√©es des maisons de retraite arrivent ici, elles sont jet√©es dans cette machine."",B2";;;;;;;;;;;;
"3795,""Par ailleurs, Elle, qui habite √† Paris, nous explique que son quotidien est devenu tr√®s difficile en raison des locations saisonni√®res : """"Les arriv√©es et d√©parts √† n'importe quelle heure de la journ√©e, les f√™tes toute la nuit, les groupes de touristes qui envahissent le hall de l'immeuble avec leurs valises. On ne se sent plus chez soi."",B1";;;;;;;;;;;;
3796,Qu'est ce que vous faites dans le parc?,A1;;;;;;;;;;;;
"3797,""Sa r√©sistance avait exalt√© toutes mes sensations, toutes mes id√©es : je revenais des emportements qui l'effrayaient √† une soumission, √† une tendresse, √† une v√©n√©ration idol√¢tre."",C1";;;;;;;;;;;;
"3798,""Mais, tout comme l'uploading du cerveau peut √™tre consid√©r√© comme un arch√©type nous permettant de penser l'identit√© num√©rique, les r√™veries de la nanotechnologie mol√©culaire apparaissent comme l'horizon lointain des recherches d'aujourd'hui."",C2";;;;;;;;;;;;
"3799,""Quand j'√©tais petit, j'habitais √† la campagne je voulais √™tre √©crivain"",A1";;;;;;;;;;;;
"3800,""Un lundi, Franck et Guillaume, qui travaillaient tous les dimanches comme extras dans un autre restaurant sur l'avenue, se sont rendus au chevet de leur grand-m√®re"",B2";;;;;;;;;;;;
"3801,""Il appartient √† l'homme de ne pas se laisser intimider ou s√©duire par la puissance des robots au point de perdre le sens de la sp√©cificit√© des comp√©tences purement humaines: l'illogisme apparent propre √† l'√©motivit√©, √† la sensibilit√© et √† l'imagination symbolique rend ces facult√©s inimitables par des machines, m√™me programm√©es pour simuler l'empathie."",C2";;;;;;;;;;;;
"3802,""La soci√©t√© fut fond√©e en 1931 par Ferdinand Porsche, puis reprise par son fils Ferry Porsche."",B2";;;;;;;;;;;;
3803,Les journalistes ont mis la v√©rit√© au grand jour sur l'affaire des d√©chets radioactifs.,B2;;;;;;;;;;;;
"3804,""Autant faire profiter l'Allemagne de leurs comp√©tences a-t-elle pens√©, surtout que la r√©gion manque cruellement d'enseignants."",B2";;;;;;;;;;;;
3805,Le ventre se trouve √† la partie inf√©rieure du tronc,B1;;;;;;;;;;;;
3806,Ma soeur pr√©f√®re aller √† la plage pour lire et bronzer.,A1;;;;;;;;;;;;
"3807,""L'adjudant interrogea Fabrice, qui lui parla de son enthousiasme pour l'Empereur avec un accent fort suspect ";" sur quoi ce sous-officier le pria de le suivre jusque chez le colonel, √©tabli dans une ferme voisine."",C1";;;;;;;;;;;
3808,Mon papa est italien et il est fleuriste,A1;;;;;;;;;;;;
3809,Fais attention!,A1;;;;;;;;;;;;
3810,Je la consid√©rais comme une cr√©ature c√©leste.,B2;;;;;;;;;;;;
"3811,""Avant Jack Kerouac, mais apr√®s Fran√ßois Villon, Lajos Kass√°k affronte les espaces ouverts, de Budapest √† Paris en passant par l'Allemagne et la Belgique, et s'en souvient en 1927, lorsqu'il entreprend son autobiographie."",C2";;;;;;;;;;;;
3812,Mais pas en proposant des portions microscopiques pr√©sent√©es de mani√®re pompeuse.,B2;;;;;;;;;;;;
"3813,""Direction Petit Bourg, en Guadeloupe"",C1";;;;;;;;;;;;
"3814,""Doux comme un agneau, ses m√¢choires carr√©es lui dessin√®rent bient√¥t un profil de gardien."",B2";;;;;;;;;;;;
"3815,""Dans tous les cas, l'un des conjoints √©tait belge, l'autre √©tant italien, marocain ou za√Ørois."",B2";;;;;;;;;;;;
"3816,""Evoquant les conditions d'examen concomitantes au S√©nat du pr√©sent projet de loi et des projets de loi relatifs √† la limitation du cumul des mandats, il s'est √©lev√© contre le choix du S√©nat de lier, par le biais d'un marchandage choquant, sa d√©cision de r√©tablir un seuil de 3 500 habitants pour l'application aux conseillers municipaux de la limitation du cumul des mandats, avec celle, prise par l'Assembl√©e nationale, dans le projet sur la parit√©, d'abaisser √† 2 000 habitants le seuil √† partir duquel les √©lections municipales auraient lieu au scrutin de liste majoritaire √† deux tours."",C2";;;;;;;;;;;;
"3817,""Les oncles, les grands-parents, les cousins, cette ann√©e toute la famille se rassemble afin de f√™ter No√´l comme il se doit"",B2";;;;;;;;;;;;
3818,Je viens d'√™tre victime d'un nouveau virus Internet et je veux vous mettre en garde.,B1;;;;;;;;;;;;
3819,Il faut savoir tout faire.,A1;;;;;;;;;;;;
"3820,""Ainsi l'inalt√©rable patience de robots-instituteurs en Cor√©e du Nord et au Japon convient-elle aux enfants autistes, mais nul ne sait comment √©volueront les autres enfants qui n'apprennent pas √† composer avec les humeurs d'un professeur humain."",C2";;;;;;;;;;;;
